hid,did,uid,uname,ulink,checkindate,content,reply,CITY
1366480835,1533227234,1360694635,无底深渊,http://www.xiaozhu.com/fangke/1360694635/,2015-09,鼓楼美食街边的安静房屋，离南宋御街百米之遥，房间敞亮干净舒适，非常值得推荐！,,hz
2317461127,4332715612,1959729571,┤gK,http://www.xiaozhu.com/fangke/1959729571/,2016-06,重要的事情说三遍： 房东是个美女！房东是个美女！房东是个美女！ 房子很干净！房子很干净！房子很干净！ 住在这里不想离开！住在这里不想离开！住在这里不想离开！ 重要的事情说三遍：,,hz
2317461127,4277154212,2114104860,胡嘉涛,http://www.xiaozhu.com/fangke/2114104860/,2016-06,不错不错不错,,hz
2317461127,4264186612,1979017271,穿西装的兔子,http://www.xiaozhu.com/fangke/1979017271/,2016-07,很好 第二次住了 地理位置很便利,,hz
2317461127,4190793228,2401021163,少女康堤,http://www.xiaozhu.com/fangke/2401021163/,2016-03,房间很干净，很温馨。位置也很好，入住感受很满意。,,hz
2317461127,4114097828,436335200,季文嵘,http://www.xiaozhu.com/fangke/436335200/,2016-07,酒店式公寓的建筑，家庭温馨的装潢，独立整套的自由，周到贴心的服务！位置相当好，步行几分钟就能到解放路，吃东西买东西一应俱全，坐个公交车或打个车几分钟也就到西湖啦（步行也可以）！楼下小卖部挺方便的，主要还是房间舒服，安宁姐花了很多心思做软装，更懂得“将心比心”体察房客的感受、将所有细节都做到完美！洗漱用品很高级，还有新鲜的水果和牛奶，超级感动！,,hz
2317461127,3885414728,3006858929,0egg,http://www.xiaozhu.com/fangke/3006858929/,2016-07,真的太赞了，真是觉得是运气太好咯 房间非常干净 而且很人性化 所有的东西都齐全 老板娘人也棒棒的 地理位置也好棒 西湖走着就到啦 以后一定还会来,谢谢，期待下一次的遇见！,hz
2317461127,3765889028,1812160835,xz一笑奈何,http://www.xiaozhu.com/fangke/1812160835/,2016-07,房东很好，很仔细。,,hz
2317461127,3746165028,3562860229,爱蕾蕾宝,http://www.xiaozhu.com/fangke/3562860229/,2016-07,房东人很好，掉了包在店里及时帮我找回，真是谢谢了，以后有机会还去那住，地理位置非常好！到哪都方便,,hz
2317461127,3674631328,2897210063,ucfm,http://www.xiaozhu.com/fangke/2897210063/,2016-06,位置方便，走走就能去银泰,,hz
2317461127,3647250728,3472230929,kzcv5261,http://www.xiaozhu.com/fangke/3472230929/,2016-07,goooooooooooooood,,hz
2317461127,3629352328,3445641729,jpdf3773,http://www.xiaozhu.com/fangke/3445641729/,2016-07,好 周围的夜市也很热闹 离西湖很近,,hz
2317461127,3590933328,3039976829,B_,http://www.xiaozhu.com/fangke/3039976829/,2016-07,非常好的一次入住w，屋主把一切都整理妥,,hz
2317461127,3512824628,1337893735,追风的瑞恩,http://www.xiaozhu.com/fangke/1337893735/,2016-06,房间挺好的，就是上楼不是很方便,电梯是需要刷电梯卡的。我电视机旁边有放一张电梯卡哦,hz
2317461127,3504907428,3488031929,微笑7115,http://www.xiaozhu.com/fangke/3488031929/,2016-06,整洁舒适，方便安全。,,hz
2317461127,3495786528,3363247829,pv9qv8,http://www.xiaozhu.com/fangke/3363247829/,2016-06,非常方便，地处市中心，购物吃饭都很方便。房东也很热情。房间采光很好。,很好的朋友，礼貌温和，欢迎下次再入住。,hz
2317461127,3474933928,3401526029,小迷01,http://www.xiaozhu.com/fangke/3401526029/,2016-06,跟图片一样，非常满意，房东人也很好，房子里面很干净，出差在外，也能住这么温馨的房子，真的挺棒的。位置也超棒，很好找，离西湖近，附近还有一个商场，吃饭什么的很方便，要是两个人住就更好了，这次出差一个人，没人一起分享，略遗憾，哈哈,,hz
2317461127,3466587528,3452218129,wangshuangxia,http://www.xiaozhu.com/fangke/3452218129/,2016-06,房间布置的很温馨，空间也比较宽敞，有家的感觉。房东很细致到位的联系，让我一路轻松入住。我是两大两小住，床一米八，够睡一大俩小，另一孩子睡大沙发。一晚聊聊闹闹，像在家一样。另外，这里交通很便利，去文化广场只有3站地铁，去杭州烂苹果也很方便，一路地铁到达，经济快捷。喜欢这样的旅行，以后还要选择这种类型的住处。,非常好的客人，谢谢！欢迎下次再入住,hz
2317461127,3436273828,3363230929,nwwt,http://www.xiaozhu.com/fangke/3363230929/,2016-06,体验不错，酒店式公寓用作短租，可谓物尽其用。一家人出行尤其合适。第一次短租，跟房东没有太多交流，也不清楚作为房客是否尽责，如有不妥之处还请见谅。,,hz
2317461127,3412283328,2897210063,ucfm,http://www.xiaozhu.com/fangke/2897210063/,2016-06,地点太方便啦，走走就能到银泰，周围吃饭的地方也很多,,hz
2317461127,3403119228,3105131129,pmic,http://www.xiaozhu.com/fangke/3105131129/,2016-06,还行吧！房东人也热情。就是晚上睡觉的时候忘记点蚊香了被咬了几下,房间里有准备了2个蚊香液哦！,hz
2317461127,3337400928,1342319035,欧阳老师,http://www.xiaozhu.com/fangke/1342319035/,2016-06,一切都很完美！一切都很完美！一切都很完美！,,hz
2317461127,3336108628,2480615263,安妮宝宝,http://www.xiaozhu.com/fangke/2480615263/,2016-06,宝宝说非常好,,hz
2317461127,3322989628,1003927759,优秀是一种习惯,http://www.xiaozhu.com/fangke/1003927759/,2016-06,真的住到不想离开… 真的住到不想离开… 真的住到不想离开… 房东是一位短发气质美女。请我吃日本料理，鹅肝寿司非常好吃，预订前房东很有耐心的解答，入住前上午发送很详细的入住须知。根本不用担心找不到位置。 进到房间以后真的是太喜欢啦。超级大的窗户，视野非常好，很网站上的照片一摸一样，温馨干净。敷面膜躺着非常安逸… 房间位置非常优越，步行到西湖7-8分钟左右。 房东还给我送了一盘杨梅，个头虽小点，味道棒棒哒^_^ 说是她同事采摘的杨梅呢^_^h 以后来杭州只住这里啦Zzzz 最后祝房东越来越漂亮，工作顺利嗷嗷嗷^_^,,hz
2317461127,3284888728,2895319463,Allpro,http://www.xiaozhu.com/fangke/2895319463/,2016-06,房东非常热情，安排周到细致；房间位置相当不错，可以远眺西湖，楼下就是杭州有名的吴山夜市，各种小吃应有尽有，生活方便；房内环境整洁舒适，宽敞明亮，与照片描述完全相符。总之，这是一次非常完美的体验，值得下次再来哦。,,hz
2317461127,3237655528,2844234163,voicefish,http://www.xiaozhu.com/fangke/2844234163/,2016-06,房间很干净，跟图片上一模一样，房间够大，三口人不觉得局促。我们提前了2个小时入住，房东很快给搞定了。卫生间没有牙刷，请自备，其他消耗性用品很齐全，用完了房东很快给补充上了。房子的位置很不错，买东西、吃饭都方便，安全性也不错。下楼就是夜市，逛了两趟。,,hz
2317461127,3131423428,3084353829,齐齐777,http://www.xiaozhu.com/fangke/3084353829/,2016-05,爸妈住的很舒服，谢谢房东了,非常好的叔叔阿姨，欢迎再次入住,hz
2317461127,3109995628,1185626835,Unalarkin,http://www.xiaozhu.com/fangke/1185626835/,2016-04,不错不错的呀,,hz
2317461127,3080607628,1132294616,无我无为,http://www.xiaozhu.com/fangke/1132294616/,2016-05,位置很好，龙翔桥地铁上来，五分钟就到了。大厦安全措施不错，楼下晚上有夜市，不过卖的东西很普通，与环境不搭房东很细心，房间布置很温馨，除了自己需要带洗漱用品，其他的都已经有。不过80公斤以上的美女帅哥就要小心，浴室的门比较窄哦！,,hz
2317461127,3067690828,2538729463,gpjfjv,http://www.xiaozhu.com/fangke/2538729463/,2016-05,之前在小猪上关注这个房间很久了，这次去杭州直接定了这家，果然没有失望。房间跟图片里一样很干净，而且交方便，地铁站过来走一会会就到了，昨天入住的时候还碰到了房东的父母，特别好，房主本人也是很周到，特别满意，晚上楼下还有夜市，下车去杭州还会选这家,,hz
2317461127,3001339162,2325405863,丝丝小铁人,http://www.xiaozhu.com/fangke/2325405863/,2016-05,地理位置挺好的，楼下就是夜市，晚上也不吵。室内卫生装潢也是没的说，洗漱用品也很齐全，服务态度也很好！很满意,,hz
2317461127,2993168862,2933776063,pingcx,http://www.xiaozhu.com/fangke/2933776063/,2016-05,好！好！好！好！,,hz
2317461127,2949485662,2933781863,_林溪,http://www.xiaozhu.com/fangke/2933781863/,2016-05,房东人很好，房间跟照片一样，非常满意！,,hz
2317461127,2942976462,2835142163,glamourwind,http://www.xiaozhu.com/fangke/2835142163/,2016-05,整体感觉性价比很好，入住环境是闹中取静，交通方便，距离地铁，湖滨银泰，西湖都很近；入住2天的感受很像在杭州的另一个小家，密码锁方便安全，房东金小姐为人直爽利落，乐于助人。 一点遗憾是入住两天期间，如果有人能在中间打扫一下就跟完美啦。 提出一个很厚脸皮的建议：房间的设施里考虑加一台微波炉，杭州美食很多吃不完打包回来可以热一下。,,hz
2317461127,2917213462,2400723163,樱语,http://www.xiaozhu.com/fangke/2400723163/,2016-05,不想走，不想走，不想走～美人靠上敷个面膜，小桌子上看本书。自动窗帘好喜欢啊啊啊。洗面奶是我最喜欢的资生堂。地理位置超级好。边上就是吴山夜市，可惜我太累了没有去逛，但是早4.30起床时发现勤劳的摆摊人已经在楼下占位置了！那是怎样的辛苦啊啊。装修风格我很喜欢，适合女生单独住。,,hz
2317461127,2862741462,2611155063,1ryy,http://www.xiaozhu.com/fangke/2611155063/,2016-05,舒服.家的感觉.不像出门在外。,,hz
2317461127,2850675662,2302034127,糊涂很难,http://www.xiaozhu.com/fangke/2302034127/,2016-04,一切都好，下次还会住。,,hz
2317461127,2849495562,1279584035,cats,http://www.xiaozhu.com/fangke/1279584035/,2016-05,各方面都很好，很干净温馨 装修的不错，由于头一天开了十几小时车 今天起的晚退的晚了，下回还会考虑，只是停车需要停车费一天60，房子是很好很好 视野不错 多谢房东了.,,hz
2317461127,2839799062,2703239363,Hmyyyyy,http://www.xiaozhu.com/fangke/2703239363/,2016-05,很干净，很整洁，不错的一次居住，房主还贴心地准备了男女生的洗面奶，不错，推荐,,hz
2317461127,2754304262,884900459,叮叮阿娘,http://www.xiaozhu.com/fangke/884900459/,2016-04,一句话就是好，干净舒适，很喜欢,,hz
2317461127,2746424562,2630100163,leejane,http://www.xiaozhu.com/fangke/2630100163/,2016-04,房子环境不错，属于闹中取静的。离银泰商场走过去大概10分钟左右，吃饭、逛街还是蛮方便的。楼下就晚上有夜市，可惜我住的那二个晚上都是下雨，没有逛成。总体来说不错,,hz
2317461127,2719712762,743472838,阿云,http://www.xiaozhu.com/fangke/743472838/,2016-04,第一次尝试小猪短租，性价比超高，有高大上的感觉，房间有超大的落地窗，窗帘还是电动的。房间大明亮，舒适，安全。还配备了密码锁。地理位置优越，出入方便。离美丽的风景区丶西湖很近，步行过去十五分钟就可以到了。周边大型购物商场 ，吃饭也方便。楼下还有夜市。下次过去还会入住这里。还会介绍朋友过来入住，我忘记拍照片了。不过和介绍上的照片是一样的。,,hz
2317461127,2702592562,2362788663,白飞飞2,http://www.xiaozhu.com/fangke/2362788663/,2016-04,挺好的。赞,,hz
2317461127,2702167362,2543232763,i2pl,http://www.xiaozhu.com/fangke/2543232763/,2016-04,房东美女超级好的！ 虽然只临时住了一天. 却发生了些小插曲.自己马大哈的性格导致当天晚上出来逛夜市吃宵夜时把手机掉房间了. 然而要命的是密码和房东联系方式都是手机上还有各种证件.自己也不记得密码！ 以为要流浪街头了还好遇见热心大堂里的保安大叔！ 忙活了一个多小时终于联系到房东回去了！隔一天后又发现自己的相机充电器和电池也掉在哪里！临时联系美女房东帮忙解决好了！真的万分感谢！ 以后要改改自己这毛病了 房间特别好 位置也是很好 反正各种好！,,hz
2317461127,2700554362,2424413963,tiffany_77,http://www.xiaozhu.com/fangke/2424413963/,2016-04,地点超好，公寓很安全，楼下还有夜市，房间又干净又明亮，床睡起来很舒服，我们三个人也能住下，房东人很好，很热心，下回来我们还会住这里。,,hz
2317461127,2669090562,2410575063,elisa525,http://www.xiaozhu.com/fangke/2410575063/,2016-04,不错哟 干净 地理位置也很好,,hz
2317461127,2630226562,2560834263,tf2yiq,http://www.xiaozhu.com/fangke/2560834263/,2016-04,房东是个很可爱的短发女生，我很喜欢她。退房的时候我们回来的晚房锁密码已经换了，她还来帮我们开门，真的很好哦。房间的窗帘是自动的，我刚开始还觉得奇怪怎么拉不动哈哈。厕所的洗手台很大，我们两个女孩子的瓶瓶罐罐终于放得下了。地理位置也不错，住的地方楼下就是吴山夜市了，可惜我们晚上都回来的晚，错过了。夜市十点半结束的。从住的地方走去清河坊街大概30分钟路程，打滴滴也不贵，就十块钱左右。去西湖也很方便。整体来说很不错！,,hz
2317461127,2614693462,1346031635,费德乐,http://www.xiaozhu.com/fangke/1346031635/,2016-03,去杭州四季青服装城附近酒店都住满了，想到以前在杭州用过小租短租果断搜索了一下，房子就在周边靠近西湖走过去十几分钟到景区中心附近吃的很多还有个夜市到晚上十点多感觉非常惬意房子户型很明亮大窗户视野采光都非常好。出入交通也方便，下次还会入住,,hz
2317461127,2527799962,2372392563,多啦菟,http://www.xiaozhu.com/fangke/2372392563/,2016-03,相对地理位置，真的很不错诶，这个价位超值了。在朋友圈更新，很多朋友问我要了地址，可惜没见到声音甜甜的金姐房东。床头台灯置物架上灰尘很多，其他都很不错，床也软软的。要是有护发素和纸巾提供就好啦，下次来杭州也还是会选择这里哦。楼下就是吴山夜市哈，脆皮玉米很好吃哒,,hz
2317461127,2489189462,1061635478,潘采夫,http://www.xiaozhu.com/fangke/1061635478/,2016-03,内部安静而楼下路边热闹，是我最喜欢的地段。半夜步步到西湖，再遛回来，大街上吃一碗米粉，上楼安睡。谢谢房东的细致周到，您那窗帘电动按钮我没用好，不知是失灵了还是我不会操作，嘿嘿。下回还去住。,,hz
2317461127,2460980962,1821564735,白水煮一切,http://www.xiaozhu.com/fangke/1821564735/,2016-03,因为出差住在姐姐家住了三个晚上，不知道除了太棒了，还能用什么形容。距离西湖很近，走几分钟就到西湖湖边了，附近是很大型的商圈，楼下就是杭州最有名的夜市吴山夜市，距离地铁也就几分钟的路程，再没有比这儿更方便的地方了。姐姐还很贴心的提供了糖果、饼干、还有超好喝的姜汁撞奶（记不清了，是不是叫这个？）大楼的安全保障也很好，坐电梯都是要刷卡的，非常安全。姐姐人也非常好，走的时候太急了没来得及打个照面儿，到车站了还接到姐姐的电话，非常温暖～～图片前三张是房间的照片，大落地窗太合我心意了，后面三张是大雾中的西湖，工作太忙都没好好在杭州玩，下次有时间了一定再好好转一转～祝姐姐越来越好哈，咱有机会再见！,,hz
2317461127,2438692762,1253555235,孔晓媛,http://www.xiaozhu.com/fangke/1253555235/,2016-03,房子地理位置好，去西湖步行15分钟就到了，吃饭购物都很方便，楼下就是吴山夜市，房间很大，因为带着一个小朋友，空间大方便很多，沙发床也能睡人，房东人很好，还专门给我们送了小锅，让我们给小朋友煮东西吃，非常感谢。,非常好的一家三口，宝宝超级可爱。,hz
2317461127,2430133762,2330407763,Alexanders,http://www.xiaozhu.com/fangke/2330407763/,2016-03,房子很赞，和图上完全一致，房东很贴心在果盘里留了一些糖果，沐浴露和洗发水之类的都是资生堂系列，房东一早就给我电话问我什么时候到，提前帮我设定好了密码，很负责任的房东，唯一的遗憾就是最后一天没有房态了，换了一间，下次来杭州还会住,高素质的客人，离开房间十分干净。欢迎下次入住，提早预定哦！,hz
2317461127,2397330862,1979017271,穿西装的兔子,http://www.xiaozhu.com/fangke/1979017271/,2016-03,非常棒的房间！大落地窗很舒服！设施完善，床也很舒服！地段繁华、交通便利！房东人也很好哦！各种棒！下次来希望还住这！,,hz
2317461127,2382593662,1219182705,奥特曼的情人,http://www.xiaozhu.com/fangke/1219182705/,2016-03,房东姐姐敲击温油体贴 我们晚上出去玩回来不会开门还特意来帮我们 房间很干净 然后我超喜欢床的 被子有太阳的味道 真的 就像家里有太阳的时候拿去晒过了 所以睡得很暖 这个天气暖得简直热了 哈哈哈哈哈哈 床很好睡 窗帘拉开感觉也很好 还有好吃的小零食 简直满意到不行啊 下次有机会还要来,超级可爱的妹子，人美声音甜，十分有礼貌。喜欢这样的妹妹。,hz
2317461127,2357684962,944985459,bobo先生,http://www.xiaozhu.com/fangke/944985459/,2016-03,没得挑！绝对是我住过最满意的民宿了!房间布置舒适有品，有大片落地窗视野超好，楼下就是吴山夜市，晚上有很多特色小吃。还有许多特色小商品。公寓位于繁华市中心去哪都非常方便，步行到龙翔桥地铁站5分钟，步行到西湖也就10分钟，另外楼下就有公交站，可以直达去九栖烟树，可以去灵隐。离机场大巴停靠站也很近，如果你们是从机场过来，直接坐大巴车在维景酒店门口下车，斜对面这条小路进来，大概3分钟就到住处。上电梯需要刷卡，感觉非常安全放心。真的特别感谢房东的热情关照!杭州民宿的首选!住了还想来O(∩_∩)O~,带妈妈出来玩，选择住了我家，离开时不光带走了垃圾，还地拖了，被套拆下来洗了，真的是太好太好的客人了。,hz
3511180130,4621550512,1179281165,Maoxiaodou2015,http://www.xiaozhu.com/fangke/1179281165/,2016-09,房东人很好，房间住着也很舒服。离西湖很近，走着去很方便。周围吃的也多。是一次愉快的入住体验。,很有礼貌干净的一家人！,hz
3511180130,4160232828,2152633860,lydiae4,http://www.xiaozhu.com/fangke/2152633860/,2016-08,老小区，新花样。装修风格是温暖型，干净整洁。房子沿着马路，闹中取静吧～房东也是非常nice,非常有礼貌的美女房客，欢迎下次再来哦,hz
3511180130,4046957928,3634961529,玉环玉兴,http://www.xiaozhu.com/fangke/3634961529/,2016-08,房子很温馨，房东人很好,很有礼貌的房客，带了孩子来旅游，房间也保持得很干净，欢迎下次再来我家哦,hz
3511180130,3728463428,3697115829,三f,http://www.xiaozhu.com/fangke/3697115829/,2016-07,房子挺干净的，地段很不错说是市中心，到动车站打车只要20分钟挺方便的，房东人也挺好的,一家人来杭州旅游住在我家，很整洁的客人,hz
3511180130,3693219728,3218064429,dr9jk7,http://www.xiaozhu.com/fangke/3218064429/,2016-07,相对价格来说，房子真的很好，两室一厅，厨房设备也很齐全，主卧还是管道空调，空间很大！最主要的位置很好，离浙一真的很近。附近吃的超多！房子装修也很新，很温馨！下次需要还会继续住这里！值得推荐！,很有礼貌的房客，欢迎下次再来哦,hz
3511180130,3635243328,3548728629,ykq9,http://www.xiaozhu.com/fangke/3548728629/,2016-07,房间很不错，房东人也很好，下次还会再不住,很有礼貌的房客，欢迎下次再来哦！,hz
3511180130,3572838228,2588475163,你猜我猜不猜111,http://www.xiaozhu.com/fangke/2588475163/,2016-07,房东很帅哦，房子装修超级新的！感觉住进去都可以拍电影的即视感，哈哈～～楼下有很多好吃的，同行的吃货们超级愉快！四件套喔喜欢哦，翻译官同款呢、看得出来有精心布置房间，房间装修跟房东颜值一样高，哈哈……希望下次住能打个折吖、,美女房客，超有礼貌，下次你们再来长住给你打折哦,hz
3511180130,3567402628,3553909129,coo1885,http://www.xiaozhu.com/fangke/3553909129/,2016-07,屋子特别干净，地理位置也好,美丽礼貌的房客，房子保持的很干净，欢迎下次再来哦,hz
2071602482,3905400328,3761913829,changh_009,http://www.xiaozhu.com/fangke/3761913829/,2016-07,老公出差，我带老人孩子来探望入住的，感受如下1.房间很干净 2.生活必需品配备很齐全，住得很舒服，尤其带老人孩子，自己做饭洗衣服比宾馆强十倍 3.小区管理是很不错的，比较安全 4.离阿里巴巴比较近，周边有小超市，生活没问题，就是要去景区的话都相对较远 4.房东人很好，对客人很热情信任，房子住着有家的感觉,挺好的客人，非常有礼貌，谢谢给宝贝带的礼物,hz
2071602482,3464273928,2333040363,ennis2015,http://www.xiaozhu.com/fangke/2333040363/,2016-06,房东人很好，房型不错，位置也挺好，离淘宝城不到2公里的距离。此房间比较适合家庭型用户居住，因为楼上有三个卧室可用，房东装修的也很温馨。,超棒的房客，走时还帮我拖了地，扔了垃圾，非常感谢,hz
2071602482,3456876428,1830699735,想之所想,http://www.xiaozhu.com/fangke/1830699735/,2016-06,这算是来杭州第三晚，跟照片描述的一样，应该是新建的公寓，很多家具都是新的，想不到的是衣帽间都铺了床我们是两个人用不了那么多，相比之前住过的牙具等洗簌用品都是很好的，有家的感觉，位置离商业城有点距离，有快车这些不是问题，唯一不适的是，隔壁正在装修，偶尔会有点吵还可以接受，总之算起来是不错的选择,谢谢您选择兔子之家，希望有机会再次光临，我会做的更好,hz
2071602482,3436484728,2804920763,城画,http://www.xiaozhu.com/fangke/2804920763/,2016-06,位置比较好找 住的还比较舒服,谢谢亲爱的体谅，让我可以做的更好！希望有机会再次光临,hz
2071602482,3429741928,3336464229,嘟嘟冒泡滴滴哒,http://www.xiaozhu.com/fangke/3336464229/,2016-06,房东人很好，我们去的时候给我们指明了公交车路线，后来我们找不到房子，打电话给房东，房东也很耐心的和我们说。入住的时候房东把房间打扫得很干净，拖鞋也帮我们洗好了放在了门口。一进房间就拍拍拍，看到这么整洁的房间都不忍心弄乱。东西都很齐全，我们还在厨房一展身手！,很有礼貌的客人，因为押金出了点问题，一直耐心等我联系客服解决，而没有不耐烦，很感谢,hz
2071602482,3355247228,3275707529,昵om,http://www.xiaozhu.com/fangke/3275707529/,2016-06,与友人一家三口一起合租的房子，真的是超赞!一直以为离淘宝城近的旅馆价格都会很高，庆幸在茫茫人海中遇到了店主你^O^精装修的loft复式，很有情调，到处都是美美美，被洗漱台上摆放的栀子花惊艳了，啊啊啊，已经激动得无法用语言来形容了!下次去还住你那，我保证话说，到淘宝城打的才7元，有多近，你们自己体会,中国好房客，退房了还帮我把房间打扫的非常干净，替我省了不少时间，兔子家欢迎你常来做客,hz
2071602482,2936641862,2784530763,兰逸尘,http://www.xiaozhu.com/fangke/2784530763/,2016-05,很感谢房东，真的是美女哦。非常热情的帮我解决各种问题，还帮我们买了红酒杯，还送祝福（入住当天恰逢我丈夫生日）。因为宝宝太小，没能入住，很是遗憾。希望以后有机会。,挺客气，很好沟通的客人，虽然最后因为种种原因并没有在我家入住，但还是感谢！,hz
2071602482,2917018062,2904181163,康师傅红烧牛肉面,http://www.xiaozhu.com/fangke/2904181163/,2016-05,房价很漂亮，很干净,谢谢哦，非常有素质和有趣的客人！欢迎下次光临，我一定做的更好,hz
2071602482,2885720262,2807728463,排骨冰,http://www.xiaozhu.com/fangke/2807728463/,2016-05,房东人很好，很抱歉弄脏了床单,房客mm是导演系高材生，很荣幸选择我家房子拍您的毕业论文，希望一切顺利！,hz
2071602482,2837558162,2741255363,nimo和peter,http://www.xiaozhu.com/fangke/2741255363/,2016-05,五一带着家人去逛西溪湿地公园，房东家离的很近，照片和实际环境一致，非常不错，下次还会入住这里的！,超级的房客，弄的干干净净的！谢谢亲,hz
