hid,did,uid,uname,ulink,checkindate,content,reply,CITY
1195911655,1604705034,1548532135,AudreyHepburn,http://www.xiaozhu.com/fangke/1548532135/,2015-10,好就一个字，无须言表。晚上的风景的确不错，周边配套完善，稍微走几步就都有了。位置也不错，有种闹中取静的感觉。房间隔音会有点不好，但是周末也没人，倒是无所谓。床真的赞，软到不行。睡眠什么都很好。就是WiFi有时候会断一下。连不上，有点郁闷。有电视就完美了。还是习惯看看电视，不然房间里没声音怪怪的。房内有一本圣经，想必也是教徒。倍感亲切。好就一个字，无须言表。,感谢你对我们的理解，希望你能够住的舒心,hz
1195911655,1595039134,1482628935,小帆_,http://www.xiaozhu.com/fangke/1482628935/,2015-10,第二次过来住了，朋友生日，陪她到杭州这边来玩。她对我们住的地方很满意，说感觉像回到了家一样。房东还是那么亲切，房间依旧那么干净，这段地段周围有超市，商场，方便我们逛来逛去，折腾了一天，很开心，一切都是这么美好。,谢谢你的光临哦,hz
1195911655,1574969034,1508978635,百变猪猪侠,http://www.xiaozhu.com/fangke/1508978635/,2015-10,房东态度很好，东西很齐全，玩的也很开心~,?欢迎下次再来,hz
1195911655,1536943434,1204166105,yaoyao1015,http://www.xiaozhu.com/fangke/1204166105/,2015-10,我一条一条的说吧！因为要说的太多了！ 首先地理位置：超级方便！出了楼的正门口顺着小道走10分钟就到了一号线地铁口！门口公交什么的都很方便！ 第二购物：这个必须得着重说一下！超级超级超级方便！只要能找到地铁就能看到一个大型的购物场所！附近屈臣氏，肯德基，麦当劳，必胜客这些都有！只要能想到的都有。 第三吃饭的问题：这个也必须着重说明一下！超级好吃！因为我和我朋友两个人是先去的上海然后来的杭州！我们在上海待了7天，这7天在吃的方面对我来说就是噩梦！因为我是北方人，不喜欢吃甜的！上海的饭就是给我的感觉除了甜没有别的味道了！而且点两个菜就能上百！我和我朋友经常就是肯德基或者泡面！一是因为太贵！二是因为太难吃了！（有点跑题）然后我们从上海到杭州是下午五点左右！碰见个十一黄金周人超级多！早饭午饭都没吃！到了杭州安顿下就再旁边的一个叫萍姐还是什么姐的一个饭馆点了两个菜！我天我觉得这顿饭是我这么长时间吃过最好吃的了！还有旁边的新疆烧烤！也超级好吃！而且我们两点了两个肉菜才花了60元！超级便宜！ 第四居住环境！我可以说住在这绝对的不会后悔！房子里面的样子就是图片上的那样！但是外面！超级好！住在13楼，可以隐隐约约的看见钱塘江！晚上看夜景！白天看城市的风光！超级棒，如果不是因为行程的问题我一定还要在这住一段时间！都不想走了！而且房东的爸爸超级好！他骑的电动车来接的我们，还叫的他的同事一起帮我们抬行李！然后把我们带上去，给我们讲解的超级详细！去那个地方怎么坐车！怎么走！我们第一天住的时候没有热水，就用凉水凑凑呼呼的洗的！然后给房东爸爸打电话！第二天就给我们修好了！ 最后说一下！如果要是以后得朋友们要去西塘古镇玩！一定一定一定（重要的事说三遍）不要打黑车！坐火车去的到了站可以找人拼车找正规出租车！他们可以带你们走捷径然后每个人50元进西塘（正常的100元一个人）！回来碰见旅游高峰期路上堵车也不要找黑车，可以找出租车打表！这都是我的经验之谈！,谢谢你们的评价，希望更多的人能够来到杭州住上我的房子，也希望成为我的朋友……,hz
1195911655,1502760434,1476804035,lixiaoming,http://www.xiaozhu.com/fangke/1476804035/,2015-09,这个价格可以租到这个地段的房子，非常划算。我们带着孩子跟房东说想加张床，房东非常爽快就答应了。孩子休息的挺好。住的也挺舒服，比住酒店要强多了。,非常幸福的一家，小孩很可爱,hz
1195911655,1500974534,1482628935,小帆_,http://www.xiaozhu.com/fangke/1482628935/,2015-09,房东人很好，房间打扫的很干净，我还用了房间的空气净化器，刚刚吃东西有的异味全没了，赞。下次来下沙还住这，哈。,欢迎下次光临,hz
1195911655,1496812434,1486445535,这个小伙有点帅,http://www.xiaozhu.com/fangke/1486445535/,2015-09,价格合理，环境干净舒适！值得下次继续光临！,小伙子人不错，家打扫的很干净，都收拾好了让我们去拿钥匙。,hz
1195911655,1484689434,1475725235,小依宝,http://www.xiaozhu.com/fangke/1475725235/,2015-09,"环境不错,房间挺干净的，很温馨，房东人很好，去的时候不知道路，房东接的！",嗯，谢谢 我们再接再厉哦,hz
1195911655,1452644934,1440220735,笑话,http://www.xiaozhu.com/fangke/1440220735/,2015-09,在一家工作室的对门，房间还算蛮大的。不足的可能缺一台电视，也不能做饭。其他该有的都有了，房东也很好说话，约好时间就带人来打扫了。,这位朋友临走的时候把房间都打扫好了，非常感谢你的体谅。这是一栋纯商务楼所以物业要求不能有厨房。没有电视这个事情之前一个朋友也提到过，这个地方我经常会自己住的（基本不用电视）所以没有想到装这个，不过你这个建议是很好的，如果提的人多了，我会考虑装一个,hz
3254374329,3602778828,3421787429,岁月静好qm,http://www.xiaozhu.com/fangke/3421787429/,2016-07,离西湖特别近，房间也不错。大房间还有个露台，还有秋千，闲时看看书晒晒太阳蛮好。就是夏天睡软垫床闷热了点，在家都是铺凉席，不太习惯。适合年轻人在杭州旅行时住。,一家人来杭州玩的 房客人也蛮开朗的 一路聊的很愉快 有机会再来杭州哇,hz
2941366963,4287408712,4028738229,片儿川,http://www.xiaozhu.com/fangke/4028738229/,2016-08,房间干净整洁，地理位置也好，房东也很热情细心,很好的房客，房间太干净了推荐给大家,hz
2941366963,4272990212,4183740729,黄浩基,http://www.xiaozhu.com/fangke/4183740729/,2016-08,房子很温馨，也干净，特别适合小情侣小住。,特别好的房客,hz
2941366963,4160035528,3731730129,Firefox66,http://www.xiaozhu.com/fangke/3731730129/,2016-08,房东很不错，询问的问题都耐心回复了，下次还来住！,很好的房客，房间保持很干净，推荐给各大房东,hz
2941366963,4115607728,2247544445,王小苗kingar,http://www.xiaozhu.com/fangke/2247544445/,2016-08,房间很干净，很适合一家3口或者情侣旅游，交通方便，打车到西湖12块钱,非常好的房客，走的时候收拾的很干净，希望下次一定再来做客,hz
2941366963,4025848428,3978917429,明里,http://www.xiaozhu.com/fangke/3978917429/,2016-08,住的地方不错 进电梯什么的都是要刷房卡的 房间装修什么的都很棒 表白大大的落地窗！！太心水了t(*?`*)s就是被子有股莫名怪怪的味道？？(=°Д°=) 噢 对了 最最最心塞的是！！停车费一小时十块钱 一天一百块 哭成狗 我想静静.......MDZZ啊！！！悲伤那么大||Φ|(|T|Д|T|)|Φ|| 因为明天要去玩 所以再续订一晚上好了...呜呜呜 总之 除了停车的 其他都很好！,停车费一下涨了真是过分，安慰下,hz
2941366963,3923498128,3819088129,静待花开666,http://www.xiaozhu.com/fangke/3819088129/,2016-07,房间较大，与房东沟通后，增加了一个榻榻米，三个人的温馨小窝。看得出来，厨房配备的厨具几乎都是在宜家购的，而且几乎全新，甚至一些还没开封。对于出差在外几天的人来说，比住宾馆要方便许多。出大门左边三十多米进去，附近有一家比较大的菜市场，菜品多样新鲜、买了一点鲜虾及蔬菜，做了一顿可口清爽的晚餐，家的感觉呀！如果再配一支拖帕，想必那也是极好的！这几天温度太高，羽绒被显得稍微有点厚。绝对市中心，走哪儿都挺方便。单独的门禁卡，心里感觉踏实。好沟通的房东，让人暖暖的。如果可以存包，就更方便了。其实房东也答应了在房间里存包，但看到房间已出租，考虑到可能会给新客和房东带来不变，还是决定明早早点退房。下次来杭州，我会继续预订此处。,哈哈哈特别贴心的房客，下次一定要再来做客,hz
2941366963,3891272928,3520149029,糖糖0420,http://www.xiaozhu.com/fangke/3520149029/,2016-07,房间很干净整洁，交通便利,欢迎下次再来做客,hz
2941366963,3720888128,3368206529,曾唯,http://www.xiaozhu.com/fangke/3368206529/,2016-07,第一次选择民宿，总体来说房东家还是挺好的，房间很漂亮，而且交通位置也很便利，就是被子有一股不知道是什么味道，洗发露沐浴露都很好，但是为什么没有电吹风呢T_T这点很想吐槽一下。,宜家的羽绒被好像有点不得美女心啊哈哈，电吹风在衣柜里面.......没有问我我还以为找得到呢,hz
2941366963,3719858928,3489424429,颜妮儿,http://www.xiaozhu.com/fangke/3489424429/,2016-07,房间干净整洁 视眼好 不错,下次再来做客吧,hz
2941366963,3691422828,245326800,anniking,http://www.xiaozhu.com/fangke/245326800/,2016-07,还不错！朋友说很满意,非常赞的房客，下次记得再来做客,hz
2941366963,3551564628,3383186529,hexiaoqian,http://www.xiaozhu.com/fangke/3383186529/,2016-07,房东很好，因为特殊原因提早退房，也能尽量退还费用给我们。,很好的房客，希望下次能继续来住,hz
2941366963,3502818828,3393062829,鱼丸的姐姐,http://www.xiaozhu.com/fangke/3393062829/,2016-06,因为入住时间是下午两点以后，但是我们去的比较早，还是很好的提前让我们进去了。房间很干净很好，房主也特别亲切特别好。特别满意的一次入住。,非常有趣的房客，感谢来做客,hz
2941366963,3484394828,3332492029,vpt5dj,http://www.xiaozhu.com/fangke/3332492029/,2016-06,很不错哦，独立空间，床睡着也很好，对了，地理位置真心好，第一次睡这么好的位置。好想一直睡下去，哈哈哈哈,相当好的房客很爱干净，感谢选择木辰宿,hz
2941366963,3475330328,3374826629,王豆豆其实叫王,http://www.xiaozhu.com/fangke/3374826629/,2016-06,很有感觉，非常喜欢，干净清爽舒适，房东人和善，地理位置优越。,美女组团来木辰宿做客蓬荜生辉,hz
2941366963,3437577628,3211182829,pipi0824,http://www.xiaozhu.com/fangke/3211182829/,2016-06,和闺密定的一次短途短期出行 中班下班晚上十点从上海拼车去杭州 到达住处的时候眼前一亮 房间是在当地一家君庭的四星级酒店里 闺密说加上这个装修那就要再加一颗星啦 哈哈 真的性价比非常高 房东还很贴心的在冰箱里准备了饮料和啤酒 房间装饰有日式的榻榻米 两人的温馨饭桌 日式餐具 床边的摆设我开玩笑称和欢乐颂里魏渭的房子很像 哈哈哈 ～反正是一次愉快的入住体验 闺密很开心哈 还说这个价格能住到这样的房间真的很棒～如果下次再去杭州的话 这里一定是我的首选住处 去哪儿都很方便 有uber就行啦,很有爱的美女，多来做客最好了哈哈,hz
2941366963,3411681628,3380583929,xoqm,http://www.xiaozhu.com/fangke/3380583929/,2016-06,喜欢各种小物件 床很软,相当客气靠谱的房客,hz
2941366963,3386766728,3066324629,xqp8,http://www.xiaozhu.com/fangke/3066324629/,2016-06,性价比高，楼层高,非常好的房客还有国际友人希望在杭州玩的开心,hz
2941366963,3362381028,3309318129,Sifa,http://www.xiaozhu.com/fangke/3309318129/,2016-06,很不错！房东人也很好。,非常靠谱的美女房客，第一晚居然以为没空调也不问我我笑了,hz
2941366963,3341576928,3313302929,zr5a9e,http://www.xiaozhu.com/fangke/3313302929/,2016-06,房东很热情很有耐心，房间因没有熨衣板咨询房东，没想到房东决定去超市给我买买一块送过来，十分感动，因为工作原因经常出差杭州，以前经常住酒店，那些连锁酒店先别说环境不好，连服务也很差，这这里我们很满意，打算以后也会住这里，值得推荐给大家。,非常好的住客，一眼看到就知道是非常优雅的人，感谢选择木辰宿，有什么不足之处请帮忙指正一定马上执行,hz
2941366963,3327070928,3268299829,摄影师陈先森,http://www.xiaozhu.com/fangke/3268299829/,2016-06,环境很好，干净整齐，完全没有一点味道，还有厨房，一切设施都齐全，适合小情侣或者单身狗住住，房东很用心，服务很热情，回复消息速度很快，我晚到还让家人特意等我，以后再来这附近还会来住，周边也很安静，虽然身处闹市但异常清净，不错的房间…,很nice的摄影师，希望下次再来，并多多提意见嘿嘿,hz
2941366963,3278243228,2634183963,truskin,http://www.xiaozhu.com/fangke/2634183963/,2016-06,性价比超级高我的天！地理位置好交通又方便。向前走十分钟就有机场大巴直通萧山机场。这次时间紧急没怎么逛周围。然后落地窗超棒的。有落地窗还高简直就是无敌。环境很好～就是被子有点小霉味哈,哈哈很好的客人，非常感谢喜欢这个房间，被子有五套轮换，可是碰上梅雨天也是醉了，已经尽量想办法了！会继续努力,hz
2941366963,3258116028,3054366829,wzrywy1004,http://www.xiaozhu.com/fangke/3054366829/,2016-06,环境真的不错 房东人也超赞 跑到下沙来送房卡 ！还续住了一个晚上。下次来还要住这里 ！,很好的房客，居然真的做饭吃了哈哈哈真把这当家了，读的时候一定要注意语气啊！总之很棒很好玩,hz
2941366963,3211906928,2271273045,dy5p,http://www.xiaozhu.com/fangke/2271273045/,2016-06,很有特色的房间，住着很舒服，房东人也很好,特别好的住客，住了一晚非常干净，希望下次还来木辰宿做客,hz
2941366963,3084549828,3036453029,bubbles0614,http://www.xiaozhu.com/fangke/3036453029/,2016-05,房主人很好 很贴心 交通方便 房间也很温馨 下次来还会选这里,非常好的房客，爱干净的一家，遇到了太幸运了,hz
1349250135,4251696612,2041797082,seafar,http://www.xiaozhu.com/fangke/2041797082/,2016-08,人还没到杭州就已经收到了蜗牛的问候，非常贴心，等到进门的时候，就完全能明白蜗牛是怎样一个贴心和细致的人了。公寓里面一切都井井有条，卫生间和厨房的小东西一应俱全，到处都有蜗牛留下的字条，好像在自己家里面一样的温馨舒适。圆床旁边就是杭州的高楼夜景，情调满满。各种体验都很满意，下次去杭州还会来的。,,hz
1349250135,2767936462,1132505649,Jessie_J,http://www.xiaozhu.com/fangke/1132505649/,2016-04,老住户了 很温馨,,hz
1349250135,2710253662,1132505649,Jessie_J,http://www.xiaozhu.com/fangke/1132505649/,2016-04,喜欢住 舒服 安心 像家一样,很有礼貌的房客， 房间内食物喜欢一物换一物， 超有自己原则。 很招人喜欢的姑娘，不由自主新生好感。,hz
1349250135,2642960862,1132505649,Jessie_J,http://www.xiaozhu.com/fangke/1132505649/,2016-04,舒适很好的,,hz
1349250135,2488087362,2404922963,张宇帆,http://www.xiaozhu.com/fangke/2404922963/,2016-03,xx牛在杭州o了我一家。小小的居所e面十分剀埃一天[玩下砜吭谲的沙l上，累了睡在大A床上，床是我喜g的床。有那小小茶祝人坐著看著窗外的夜景，喝著地道的井。棒棒}！,房客很友善，俊男靓女哦,hz
1349250135,2482324462,1132505649,Jessie_J,http://www.xiaozhu.com/fangke/1132505649/,2016-03,还会一直住,房客超级棒，走的时候很干净。 交通也很顺畅，虽然没有见到面， 但是感觉对方是一个很好的姑娘。,hz
1349250135,2250863644,2146942660,1e1d,http://www.xiaozhu.com/fangke/2146942660/,2016-02,房间非常好 我很满意,房客很有礼貌 好评,hz
1349250135,2168554259,1643625635,黑熊86,http://www.xiaozhu.com/fangke/1643625635/,2016-01,房东非常好，房间也很漂亮，而且还有不错的水果。我到的比较晚，房东早早的把空调给我打开，让我度过了一个非常温暖的杭州最冷天。大床也很舒服,,hz
1349250135,1678476634,1210898605,郭江伟,http://www.xiaozhu.com/fangke/1210898605/,2015-10,第二次入住，感觉超赞,房客已经第二次入住了，还续租了好多天，很好的接待体验。,hz
1349250135,1538131534,1139085965,宓宓宓,http://www.xiaozhu.com/fangke/1139085965/,2015-10,在杭州的十一假期就要结束啦超级感谢蜗牛小姐！住的酒店式公寓 环境特别好 在世贸君亭酒店楼上 安全性非常高哦 蜗牛为我们准备了好吃的水果 房间呢整体风格是温馨又简约 但是家庭的温暖也很足哦 不管是大大舒适的圆床 还是好看的床头灯 还是舒服的沙发 都有浓浓的家的感觉呢！超级喜欢 在房间拍了好多照片 设施也很全 蜗牛的吹风机好评！还有卷发棒呢 厨房物品也很多哦 不过我们太懒啦 直接出门吃了 楼下就有很多好吃的 旁边的街也有很多店铺 超级棒 还有交通很便利 不管是地铁站还是公交车站 到景点都很方便！下次再来杭州还要麻烦蜗牛招待啦哈哈哈哈,非常漂亮的三个姑娘，人很好。 希望我的小公寓能给你们带去家般窝心的感觉 欢迎下次入住。,hz
1349250135,1434037034,1430400035,小猪小叶,http://www.xiaozhu.com/fangke/1430400035/,2015-09,总体而言还是中上的,关于订房背景：昨晚您匆匆订房 关于安全：真的不安全吗？房间门是密码锁，一个客人一换。电梯需要刷卡才能到达我的公寓楼层。 关于描述：和照片拍的不一样吗？房间的格局有变化吗？因为您临时订房，没有给您放水果，这点在您下单前也是跟您说过的。 关于交通：位于市中心，离西湖一公里，走路到杭州大厦，不方便吗？ 关于性价比：楼下酒店会员价500 一晚，性价比不高吗？,hz
1349250135,1353401734,1210898605,郭江伟,http://www.xiaozhu.com/fangke/1210898605/,2015-09,房东准备了水果，烧了热水 厕所很干净，刚入住的时候马桶上还有一次性马桶纸。 房间内布置很温馨，各种贴心小提示。 要是书架上有杭州旅游攻略就更好啦！,哈哈，很有礼貌的房客，我会认真考虑你的建议，祝旅途愉快,hz
1288390135,4472947612,4081198329,0n89,http://www.xiaozhu.com/fangke/4081198329/,2016-08,地理位置好，交通方便，环境布置好，老板人热情，总之非常好，下次还要来。,谢谢您的点评，欢迎下次入住！,hz
1288390135,4305081112,2620429363,Ccchen1003,http://www.xiaozhu.com/fangke/2620429363/,2016-04,很舒服 卫生也做得很好,,hz
1288390135,4268758712,1578414435,caj77,http://www.xiaozhu.com/fangke/1578414435/,2016-08,整洁，卫生，位置好，房东人很好！,谢谢您的点评，欢迎下次光临！,hz
1288390135,4228404912,4101154129,7txe,http://www.xiaozhu.com/fangke/4101154129/,2016-08,环境不错，交通非常便利，理想的入住，值得推荐,谢谢点评！欢迎下次光临。,hz
1288390135,4094512028,4009795529,裴宇航,http://www.xiaozhu.com/fangke/4009795529/,2016-08,房间非常好，装修温馨，简单干净整洁，设施齐全，房东人很好，非常感谢，下次再见,谢谢幸福的一家人，离开前把房间收拾很好，就像自己的家一样，祝你们旅途愉快！,hz
1288390135,3926828628,2602624363,King狮子王,http://www.xiaozhu.com/fangke/2602624363/,2016-07,帮朋友订的，还不错，位置交通都很便捷，房东人也很随和，下次有机会再住你家哦～,谢谢您的点评！,hz
1288390135,3913632328,3484798529,摄氏42,http://www.xiaozhu.com/fangke/3484798529/,2016-07,房间很整洁，房东人很好，期待下一次入住,房客虽未谋面，我感觉是一位很细心的人，退房后听阿姨说房间垃圾都自己带出的。非常的感谢！欢迎再次光临。,hz
1288390135,3905095328,3849428429,Sara16,http://www.xiaozhu.com/fangke/3849428429/,2016-07,住在武林附近，离西湖文化广场也很近！就在体育场路上，周边设施不错，交通出行方便，就是早上出去的时候有点堵车！房间整体感觉很好，我很喜欢落地窗的房间，房间很有家的感觉，连创口贴都有的，因为不小心切菜的时候弄伤了～所以感觉很温馨呢！虽然没有见到房东，但是随处可见的小便条让人感觉很好，以后有机会还会入住的……我走的时候把房间都稍微打扫了一下，哈哈哈,谢谢你的点评！欢迎下次再来。,hz
1288390135,3717916128,3646766429,Dior极品咖啡,http://www.xiaozhu.com/fangke/3646766429/,2016-07,确实跟评价的一样好，服务灰常好，环境灰常好 各种设施设备一应俱全 门禁感觉很安全 人员结构有素质 通风灰常好 还有冰箱 可以烧菜 可以叫外卖 停车也方便 24小时热水 为啥一定要 评价满一百个字 才给积分捏,虽未见客人，通过几次通话就能知道是一位豪爽之人，非常的感谢您的入住，欢迎有机会再住我家。,hz
1288390135,3689391328,1611981935,Charlenei5,http://www.xiaozhu.com/fangke/1611981935/,2016-06,房东人很好 住了一个月房子很喜欢 交通也方便 物业治安都很好 下次来还会住,谢谢美女的点评，欢迎你下次再来！,hz
1288390135,3598903328,694594038,hightop,http://www.xiaozhu.com/fangke/694594038/,2016-05,位置距离地铁口有一小段距离，需要过2个路口，有网络电视，无线也很好，卫生间洗发水、洗沐浴露、牙膏一应俱全，卫生条件还好，只是卫生间下水道总反味，味道不好闻，卫生间又没有门，只有珠帘，很好看，但关不住味。除了这一点外，其余都和图片一样，走的时候把卫生打扫了一下，有笤帚、有抹布，打扫也很方便，垃圾带走了。进门有密码，进电梯需要门禁卡，很安全，也很安静，晚上休息很好。,你好，谢谢您的点评，你说的卫生间的问题我已解决好了，卫生间除了帘子外我又加装了一道布帘哟，欢迎您有机会还来我家体验！,hz
1288390135,3377286628,1643248735,gjxz,http://www.xiaozhu.com/fangke/1643248735/,2016-06,因为定的房间管道维修无法入住，老板给免费换了另外一套位于武林夜市里面的民宅，位置确实非常好，出门吃喝玩乐一应俱全，离西湖也非常近，房子以前应该是个妹子住的，装修非常用心也非常温馨，卫浴都是科勒的，马桶电动的，卫生间都是贴的马赛克，档次根高，适合两口子住，住的很满意，有机会下次来杭州玩还会选择的,因他们预定的房间临时出了点状态，就把我西湖边武林夜市的精装民居让给他们住了，夫妻俩真的不错，入住时我去接的，谈吐都是很直爽，特别让我感动的的，退房时把房间收拾的干干净净的，走进就像刚入住时一样，连热水器都帮关好了。生活很是细心，真的非常的感谢你们，欢迎下次光临！,hz
1288390135,3289653528,3014316329,az1f0h,http://www.xiaozhu.com/fangke/3014316329/,2016-06,总体还好吧，由于沟通不到位导致等电梯卡等了一个多小时，周围也有吃饭的地卖水果的地方，，交通也算便利，就是天气原因卫生间会有点味道,,hz
1288390135,3271392728,2853253063,mlk9,http://www.xiaozhu.com/fangke/2853253063/,2016-06,这次是小猪上最舒服顺心的一次入住了，房间很舒适，也很整洁，非常安全，交通当然也很是方便！房东很贴心，在每个可能不明白的角落都会有提示，而且第一天入住时的晚上因为没弄明白一些小情况打了几个电话给房东问，他也很耐心的解答！另外，房东真的很通情达理，真的尽量满足我所有的要求！以后住小猪时一定还选这里！,首先，感谢你选择入住我家！给你们提供一些力所能及的服务是我们应该的，交通，安全那是必须的！小猪的宗旨是居住自由主义，客人住的顺心就是我们最大的安慰。再次感谢！,hz
1288390135,2933157862,734998038,我系欣欣,http://www.xiaozhu.com/fangke/734998038/,2016-05,临时订的房，地理位置很好，周围环境也很好，什么便利啊吃饭啊都有，房子装修很好看，豪华装啊，比图片好看呢，很新很干净，卫生间都很干净，房东也很有耐心很好人，离地铁站大概7.8分钟路程吧，不算远，离西湖景点很近，地铁3站就可以到，床很软很舒服，整体性价比还是很高很高的,谢谢美女这么详细的描述，欢迎下次再来！,hz
1288390135,2930734062,2159375860,全绵女,http://www.xiaozhu.com/fangke/2159375860/,2016-05,老板超仔细超热情…房间布置温馨…干净卫生…推荐入住哦…下次去还要住这里,谢谢您的点评，欢迎下次再来住我家！,hz
