hid,did,uid,uname,ulink,checkindate,content,reply,CITY
1504769735,2050721681,1733480235,emily0608,http://www.xiaozhu.com/fangke/1733480235/,2015-12,再次住了好多天，棒棒哒,房客退房的时候，房间很干净，很爱护房间的设施！喜欢，赞一个！,hz
1504769735,1944116070,1733480235,emily0608,http://www.xiaozhu.com/fangke/1733480235/,2015-12,配套很齐全,很棒的房客，欢迎下次再来入住哦！,hz
1504769735,1891158870,1733480235,emily0608,http://www.xiaozhu.com/fangke/1733480235/,2015-12,不错，持续入住,很好的房客。爱干净的女生！挺好,hz
1504769735,1886198634,1811315335,猪猪侠222,http://www.xiaozhu.com/fangke/1811315335/,2015-11,全五星的体验,小伙子很帅，很爱卫生。房间内的设施都很爱护。很喜欢这样的房客！,hz
1504769735,1830238634,1733480235,emily0608,http://www.xiaozhu.com/fangke/1733480235/,2015-12,第一次短租好棒～耶?，下次还回来，性价比高,很爱干净的房客，很可爱的女孩子。房间收拾得很整齐！,hz
3004934429,3370713428,1215750205,burberryss,http://www.xiaozhu.com/fangke/1215750205/,2016-06,很好的房东MM，热情、好客，房间也是干净简洁，布置很温，有家的感觉，值得赞一个，下次还会过来住宿哦，么么哒！,很和善的两位姐姐，一大早就出门了，都没来得及道别，希望你们身体健康一切顺利，欢迎下次再来～,hz
3004934429,3218020828,1645228235,c溪,http://www.xiaozhu.com/fangke/1645228235/,2016-06,非常开心的一次入住，房东妹妹温柔体贴，让人舒适踏实，就像从未离开过家一样，温暖，感谢妹妹给准备的早餐，么么哒……,不客气哦，很体贴的姐姐，生怕麻烦我，非常好说话，声音好温柔，我还以为比我小呢，哈哈，下次有空来玩，希望你像在家一样轻松自在，祝生活愉快，一切顺利哦～,hz
3061396128,3940218428,3681707729,jztgwsc6,http://www.xiaozhu.com/fangke/3681707729/,2016-07,挺不错的，电视很棒，还可以做饭。位置也很不错，附近吃饭的地方，超市都挺多的，离地铁站也很近,来之北京帅气的九零后，感谢给的5分好评，来住了5天，阿姨也没为你们做点什么，抱歉，招待不周啊！欢迎下次再来，祝每天开心！,hz
3061396128,3292037828,3216971529,代客撩妹,http://www.xiaozhu.com/fangke/3216971529/,2016-06,还可以，交通方便，房东姐姐靠谱，我们入住时间比较晚，房东姐姐还专程下来接我们并且帮我们提行李，很感谢她，我们第二天因为要去横店，所以很早就起床，房东姐姐后来帮我们把行李提下三楼并且帮我们保管了一整天，非常谢谢她，而且住宿干净，位于市中心，离地铁站很近，满意。,身材高挑 外貌标准的一对情侣，刚看到你们时还以为接待的是运动员，真羡慕你们的青春年华，在房间待的时间应该还没十个小时，付上节日价两百多元，感觉为你们不值，很想为你们弥补点什么但没机会，希望你们再次来杭，一定用另一种方式接待你们！祝你们天天开心！,hz
2720056163,3413789028,3367864329,angel00130,http://www.xiaozhu.com/fangke/3367864329/,2016-06,不错，适合我们自由行,姐姐是带着女儿来杭州玩，女儿高考考完了，祝考个理想的大学哦。 姐姐很好交流，很礼貌。姐姐的女儿很阳光活泼。离开的时候房间打扫整理的很好。 祝姐姐一行旅途愉快。,hz
2720056163,3216577128,1216527605,你是傻逼吗嗯,http://www.xiaozhu.com/fangke/1216527605/,2016-06,老顾客了 好评,妹子第三次入住了。欢迎哦。,hz
2720056163,3045500028,2784530763,兰逸尘,http://www.xiaozhu.com/fangke/2784530763/,2016-05,很投缘的房东，可惜无缘相见。只是和弟弟聊了许多，绝对好男人，疼老婆。还有他家女强人和小美女都刻在心里，希望下次有机会见到。老公住在这里获得了很多人生感悟，希望下次自己有机会入住。,十分荣幸能够认识哥哥姐姐，哥哥阳光帅气，看上去要比实际年龄小不少，气宇不凡，十分有礼貌，离开时把房间整理的十分整齐，连垃圾袋都收拾了。十分感谢。 房间是姐姐预订的，因为当天姐姐带孩子回北京了，没见到。不过和姐姐聊了蛮多，姐姐也有做小猪房东的想法哦，可惜没见到姐姐，充满好奇心。,hz
2720056163,2939456062,2604012163,m0ac,http://www.xiaozhu.com/fangke/2604012163/,2016-05,小区环境很好，很安静。边上有大型综合体和旅游景点。房东很热情，来外面接人。房间卫生也很整洁，总体非常舒适。,阳光帅气的小伙子，文质彬彬的，有礼貌，欢迎下次再来啊。,hz
2720056163,2911898562,1185810135,tlg1,http://www.xiaozhu.com/fangke/1185810135/,2016-05,离西溪湿地很近，住宿外吃的很多和便宜。4 5百米的地方有超市，有饭馆(外婆家)吃饭要排队的！早饭也很多！地方位置好，老板人更好。下车后接我们带我们找到超市 饭馆 自行车租赁的地方。对我们做西溪湿地的旅游提了好的建议。,二位保定远到而来的大哥，接到二位大哥时，带他们简单边上走了走。边走边聊，二位大哥真厉害，一个多月前就订了机票，关键来回的机票比单程的火车票还便宜。 要跟大哥们好好学习，这样出行确实蛮好的。 二位大哥玩的愉快。,hz
2720056163,2906159362,2512719363,Bingni,http://www.xiaozhu.com/fangke/2512719363/,2016-05,房主很热情，很好相处，亲自在小区门口接待我们，在一起也聊了很多东西。很开心带亲人来这里让她们有不一样的体验，这边离西溪印象城很近，吃饭购物也很方便。谢谢房主热情招待啦！,很好沟通的母女俩，妹妹很善良，而且还年轻，蛮漂亮的。母亲来看她的，顺便来杭州玩玩。他们很有礼貌。希望她们玩的开心，妹妹早日找到如意的工作。,hz
2720056163,2877984362,2439538963,wzj2888,http://www.xiaozhu.com/fangke/2439538963/,2016-05,这是第一次用小猪短租租房，也是闲着无聊想体验下所以才订了一个西溪湿地边上的。本来说好是准备在西溪湿地玩的，可是下了两天雨，计划就泡汤了。 如果想去西溪湿地玩的朋友，住这一家非常划算，地理位置好，就在印象城后面，吃饭很方便，小区环境也挺好，空气比市区好太多。出来就是西溪湿地东区，地理位置我就不在多介绍了。 房间怎么说呢，是新房，有空调，衣柜，冰箱。但是没有毛巾，浴巾，牙膏，牙刷，吹风机，我们自己去留下华联超市买的日常用品，希望房东可以备齐这些一次性东西，让住户更加方便。,一对很阳光的年轻人，小伙子很阳光帅气，人很好沟通，进门放下行李，就去西溪玩了。谢谢小猪，让结实了很多人。欢迎下次光临。,hz
2720056163,2836262762,2743358463,会飞的瘦子,http://www.xiaozhu.com/fangke/2743358463/,2016-04,很舒服的房子 刚到的时候是晚上，坐了大半天车，一进门，感觉超级温馨舒服。有个很大的阳台，有厨具和桌子，想要做饭也没问题。第一天忘了提前说了，厨具都在别的房客那，后来第二天房东就送了一套新的来。卫生间里的东西也都很全，就是牙刷牙膏是要自己带。房东基本上你有问题就能很快出现。房子去印象城大概就3分钟 很方便。景区也就在边上。总的来说，很不错的一次体验,很年轻阳光的一对，男孩还有点腼腆的。比我想象的要自立，还会自己下厨，做点简单的自己吃，真不错。希望他俩早日修成正果哦。,hz
2720056163,2772154162,1550088635,jay88,http://www.xiaozhu.com/fangke/1550088635/,2016-04,新装修，房间宽敞明亮，去旅游景点很近，下次还来。,很有修养的哥哥姐姐。房间整理的很好，离开的时候和刚入住的时候，一样整洁，床上收拾的十分整齐，垃圾都收拾了。还帮忙把阳台上晒干的床单枕套等收拾整理好，谢谢。祝哥哥姐姐平安到家。,hz
2720056163,2752131762,2595064663,ld302,http://www.xiaozhu.com/fangke/2595064663/,2016-04,地理位置不错，环境也挺好的，距离西溪湿地百米路，隔壁印象城…还会选择再次入住…房东王大哥，服务蛮周到的…,晚上8点多才到的。出门去接到他们的时候，男孩很客气，很阳光，他们俩见到就让人很有亲切感。早上走的时候，还把卫生简单打扫收拾了下。很好的房客。,hz
1150666205,1575474334,1504457935,不知道以后再改,http://www.xiaozhu.com/fangke/1504457935/,2015-10,很好，很干净，,亲，欢迎你们入住我家，希望你入住满意，下次来杭州还选择入住在我家，谢谢,hz
1150666205,1364102634,1351412635,sichuhang,http://www.xiaozhu.com/fangke/1351412635/,2015-09,环境很好，很温馨，卫生很干净，很安静不吵,亲，欢迎你们入住我家，希望你入住满意，下次来杭州还选择入住在我家，谢谢,hz
1150666205,1330641634,1264813135,盛夏幻日,http://www.xiaozhu.com/fangke/1264813135/,2015-08,挺新的，比较可爱,亲，欢迎你们入住我家，希望你入住满意，下次来杭州还选择入住在我家，谢谢,hz
1150666205,1267715434,1174756165,0223大惊喜,http://www.xiaozhu.com/fangke/1174756165/,2015-08,第一次体验，感觉很不错。交通便利，小区边上就是一个公交站。社区比较新的，安全程度高。房间位于22楼，高处感觉好。房间内的家具都是比较精致的，装修是欧式，很温馨。这次是奔着可以做菜来的，厨房的用品都很好，美的的电饭锅，电磁炉，苏泊尔的平底锅，总之做菜比较愉快的，电视是联网的那种智能电视，海量点播。房间里还有几盆绿植，挺有心的。房东人也很好的，下次还会再来。,亲，欢迎你们入住我家，希望你入住满意，下次来杭州还选择入住在我家，谢谢,hz
1150666205,1263087334,1166848875,Leroy,http://www.xiaozhu.com/fangke/1166848875/,2015-08,不错，挺干净的,亲，欢迎你又一次入住我家，希望你入住满意，下次来杭州还选择入住在我家，谢谢谢,hz
1150666205,1254944334,1227178705,赵科茹,http://www.xiaozhu.com/fangke/1227178705/,2015-08,到杭州3天小雨连绵不绝，第一天车子坏了，拖车拖到修理厂，杭州对外地车的限号措施厉害，很多时段地段都不能走，贴条罚款迎接不暇，唯一的安慰就是小猪上订的住房，温馨怡人生活用品质量品质讲究，房间布置细致入微，可以做顿饭安慰我们一下。总之来杭州的朋友开车一定要查询安排好，否则损失不可预估。,：亲，欢迎你们选择入住我家，希望你入住满意，下次来杭州还选择入住在我家，谢谢,hz
1150666205,1253123334,1219724805,秀秀最爱,http://www.xiaozhu.com/fangke/1219724805/,2015-08,环境不错，很温馨，也很舒服，设备一应俱全。本打算住两天，但是觉得很好，多住了一天，有家的感觉。更难得的是阿姨人很好，因为洗漱问题半夜11点半给她打电话，她都会热心地上来解决。赞一个！,亲，欢迎你又一次入住我家，希望你入住满意，下次来杭州还选择入住在我家，谢谢,hz
1150666205,1241405534,1166848875,Leroy,http://www.xiaozhu.com/fangke/1166848875/,2015-08,很干净简洁,非常感谢亲选择入住我家，欢迎下次来杭州还住我家.,hz
1150666205,1212126304,1208926805,伯乐小胡,http://www.xiaozhu.com/fangke/1208926805/,2015-07,好评，住的很舒服。房间装修的很漂亮，家具也齐全。房间高层，风景很漂亮。,非常感谢亲选择了入住我家，欢迎下次来杭州还住我家,hz
1150666205,1169908974,1072329778,BabyL,http://www.xiaozhu.com/fangke/1072329778/,2015-06,我第二次住他们家，感觉真的好亲切，阿姨就像自己家的长辈一样替你考虑出门的事情入住的细节等等，要是还有下次一定还是选择这家,亲，我感谢你又一次选择了我家，我希望你在家开心快乐有幸福的感觉,hz
3427013830,4237239912,2049929482,ws60,http://www.xiaozhu.com/fangke/2049929482/,2016-08,订了五天住到第三天的我琢磨着就这么回去不尽兴啊，于是又住了五天，反正天天就是发呆睡觉喝茶聊天，对我来说每天只要抱着手机在wifi够得着的角落看远处的山就够了，晚上山里的蛙鸣和虫叫很有禅意，此起彼伏。桂生兄为了招待我们全家算是用尽了洪荒之力，不胜感谢啊，现在的问题是下次去的时间是隔一个月好呢还是明天就出发呢？我很纠结,,hz
3427013830,3615681628,2958242063,钟Lynn,http://www.xiaozhu.com/fangke/2958242063/,2016-07,太多的感谢，不知如何表达。就像陶渊明的诗那般，“此中有真意，欲辩已忘言”。那天我们象黑夜里的四个“不速之客”。周五晚上工作结束后，两个大人，老母亲，带着小孩从外地奔赴杭州富阳，到达时已是第二天凌晨，黑夜里陶老师夫妇一直未睡耐心等候我们。早晨醒来四个人又唧唧喳喳讨论赶去中国美术学院报名，聒噪不已，一路上看到富阳到象山的美术一条街的美景。到校园，在空荡荡的办公楼里，发现我们提早了一天来，然后失落地回到富阳山里陶老师家的干净清凉的空调房里狠狠地睡了一个下午。正想着出去订餐，陶老师用自家种的蔬菜水果和家养的鸡烹饪美食款待我们，餐后，参观了陶老师的画室，在杏花微雨的夜晚的书房，有几个小学生在认真学书法，听说是陶老师免费教的附近乡邻的孩子书法和画画。还与陶老师的父亲，一位当地基督教会的长者交流了信仰的智慧观，他话不多却言语中肯。第二天，陶老师亲自开车送我们一家到美院象山校区去报名，直到我们把孩子行李搬上学生宿舍安置妥当后，陶老师才开车离开。在人心疏离的城市里生活这么久，第一次在小猪上订民宿，就遇到这么好民宿主人，真得有千般感谢说不出口。默默愿神大大地赐福陶老师一家人，赐福富阳充满灵性的山山水水和人家。想象中富阳的陶老师一家应该是历史上田园诗人陶渊明的后裔，虽未曾确认，但我们在富阳的这家山林院子，处处可见传说中的陶五柳家的家风与隐逸精神。 如果有什么建议的话，陶老师可以利用自家院子后山林空地上建一个游泳池，把附近山泉引入此间。那样想必小猪和Airbnb的租客会纷至踏来！,不远千里送女儿来中国美院学习。同样是孩子的父母，让我感到羞愧！房客夫妇都是研究生，谈吐间确非常谦逊，对我家人也非常和蔼，属于典型的满桶水！退房时，还将房间的物品进行了整理，非常好的房客，适合做深交的朋友！,hz
3427013830,3501053128,3484445629,湖光山色中,http://www.xiaozhu.com/fangke/3484445629/,2016-06,非常不错的地方。亲们如果没去是一大损失。房东是位有志青年，非常好客，宾至如归！山青水秀，食物是原生态，热情是原生态，服务是原生态，喝的是山泉水，住的是大别墅，非常整洁干净。气温比城里低5度。值得一去！走时房东还送我们本鸡蛋，甜玉米和自家的黄瓜。。。,第一次开张就遇到这么好的客人！感觉原本就是一家人！吴哥烧菜手艺一流，谈吐温柔儒雅，典型的有内涵，有深度，阅历丰富的男人！爱好广泛，知识渊博，应该是值得学习和深交的老师和朋友！期待再次促膝畅谈！,hz
2472644563,3316737328,1606493135,蛋子的春天,http://www.xiaozhu.com/fangke/1606493135/,2016-06,房间超大。可以烧烤可以做饭环境也比较好。很满意大家玩的很开心,有礼貌，容易沟通的年轻人,hz
2376814263,2984038362,2911039263,Fontanaditrevi,http://www.xiaozhu.com/fangke/2911039263/,2016-05,房东人很好，我们开车晚了，又下雨，她还出来接了~非常感谢，虽然只住了一晚但很温馨。比住酒店划算很多，房间和厨房都非常干净，价格也让人觉得性价比颇高！强烈推荐想来桐庐玩的人住在这里！附近还有百岁峡漂流和瑶琳仙境，交通便利！,阳光帅气的姑娘小伙们很有礼貌，到的晚了生怕打扰主人一个劲的说不好意思，用过的餐具都洗的干干净净，放回原位。欢迎下次光临！,hz
1209585205,4111444628,1177178265,LITTWS,http://www.xiaozhu.com/fangke/1177178265/,2015-08,房东姐姐人很棒 房子也很好,,hz
1209585205,1933293670,1264813135,盛夏幻日,http://www.xiaozhu.com/fangke/1264813135/,2015-09,房间还算很新的，地理位置还不错，距离浙江大学紫金港校区比较近，距离城西银泰和沃尔玛印象城也还行。第三天住的时候热水器的淋浴喷头坏掉了，不过好在维修大叔来得比较快，很快就修好了，没有多少不方便。可惜房子楼层不高，隔音效果也一般般。,,hz
1176262265,4184066028,3070797729,不基的我,http://www.xiaozhu.com/fangke/3070797729/,2016-08,房东出差啦，房东妹妹再管理，很热心。女朋友因为导师突然发了个任务，没带电脑，于是找房东借了电脑。房间租满了，所以每天用厕所要排队，wifi有点慢。我们的房间很舒服，大床，房间风格非常清新，就像房东写的小告示：欢迎回家。很满意，下次还要来住,,hz
1176262265,3838301128,3572037129,哈哈哈哈哈哈哈m7,http://www.xiaozhu.com/fangke/3572037129/,2016-07,房间很舒服 有个阳台可以晒衣服 房东人也很好,,hz
1176262265,3719220228,3572037129,哈哈哈哈哈哈哈m7,http://www.xiaozhu.com/fangke/3572037129/,2016-07,交通挺方便的 而且房东也很好 房间没有想象的那么大但是真温馨 总的来说 住的很舒服 也很喜欢,,hz
1176262265,3498231228,362153300,沙发客小葵,http://www.xiaozhu.com/fangke/362153300/,2016-06,和朋友相约来杭州玩，欣赏杭州美得风景，遇到这么好的房子，一次身心愉悦的体验。房子漂亮温馨，很干净。美女房东很细心，告诉我们各种游玩路线，省了我们很多时间。房子离西湖挺近的，去火车站也方便。下次如果来杭州还会来入住。,,hz
1176262265,3474306928,1242689035,路小平,http://www.xiaozhu.com/fangke/1242689035/,2016-06,房子很是干净舒适，各项设施都很便利。第一次尝试与房东住在一起，小惊喜~房东姐姐人很nice，给我们用她自己的公交卡，还切水果给我们吃。很开心。,,hz
1176262265,3463656528,2156090360,安宁金刚芭比,http://www.xiaozhu.com/fangke/2156090360/,2016-06,1.房子很宽敞，很干净整洁。 2.房东都是年轻的姑凉，人很nice. 3.房东为我俩还提供了当地的城市公交卡，让我们出行更加方便，还省钱。 4.住宅小区环境也跟清幽，绿意十足，楼下就有中型超市，生活很方便。 5.出了小区大门，前走，左边或者右边都有吃早饭或者正餐的小饭馆。,,hz
1176262265,3327214128,1300836235,Warren2015,http://www.xiaozhu.com/fangke/1300836235/,2016-03,一直住，下个月还来,,hz
1176262265,3264874428,2474941063,戴育明,http://www.xiaozhu.com/fangke/2474941063/,2016-06,交通便捷！,,hz
1176262265,2995982762,1162817005,吉田哲夫,http://www.xiaozhu.com/fangke/1162817005/,2016-05,帮姐姐预定的小猪房，表示位置非常好，环境不错。绝对好评。第一次利用小猪短租寻找住宿，就碰到如此满意的房东和房子，确实很值得推荐。感谢房东的好房源，也希望更多人去到杭州能够去“夏天不夏至未至”的房子体验一番。,,hz
1176262265,2981955762,2964843163,cocoqwe2016,http://www.xiaozhu.com/fangke/2964843163/,2016-05,很喜欢这个房子 房东人也很好 有机会一定还要住 早上还有粥喝 不好意思喝所以走了呵呵,,hz
1176262265,2924517362,1300836235,Warren2015,http://www.xiaozhu.com/fangke/1300836235/,2016-05,这次入住还要蛋糕吃，帅哥生日快乐！,,hz
1176262265,2896015062,2848874163,Aaron_LR赞,http://www.xiaozhu.com/fangke/2848874163/,2016-05,房东人很好，超级热情，大半夜还在楼下等我们，早上还给我们煮粥喝。房子也布置得很用心，很干净。还跟房东一起看了欢乐颂的大结局！,,hz
1176262265,2889424362,2871122863,俞夫,http://www.xiaozhu.com/fangke/2871122863/,2016-05,非常棒的一次入住体验。,,hz
1176262265,2840938062,1300836235,Warren2015,http://www.xiaozhu.com/fangke/1300836235/,2016-03,一直来，一直住，工作附近方便,,hz
1176262265,2763179262,2428869563,昂帕帕斯陈,http://www.xiaozhu.com/fangke/2428869563/,2016-03,位置不错，装修很也温馨。房东每天下班回来都会打扫卫生，房间很很干净！,,hz
1176262265,2754719262,1356800435,taiyy,http://www.xiaozhu.com/fangke/1356800435/,2016-04,第一次住民宿,,hz
1176262265,2738220362,2686027363,wwjchenzb,http://www.xiaozhu.com/fangke/2686027363/,2016-04,房间干净舒适，就是太多人共用洗手间，这点我觉得不方便，因为玩了一天大家都想早点洗洗睡觉，可是还要排队洗澡，让我抓狂，有介意的就不要租这种单间了,谢谢亲的点评呦，你们下单之前我都会跟你们说家里是合住的哦，介意的话就找找别的，主卧的洗手间本来也是可以用的，不过主卧的客人正好不在，所以抱歉啦。不过还是谢谢你的建议，我会改进的哦。,hz
1176262265,2702858762,2625188263,cs98yj,http://www.xiaozhu.com/fangke/2625188263/,2016-04,居然在这里遇到了老乡，非常好的姑娘，热情的接待我们，大家都非常的友善，感觉还是很棒的体验，楼下交通也很方便，出小区就有公交站，厨房东西也都有,,hz
1176262265,2685575562,2111111360,deep16,http://www.xiaozhu.com/fangke/2111111360/,2016-04,房子超好，很卡通。地理位置也好,,hz
1176262265,2673632462,2540844563,周大个,http://www.xiaozhu.com/fangke/2540844563/,2016-04,美女众多！！！,,hz
1176262265,2673062362,2428869563,昂帕帕斯陈,http://www.xiaozhu.com/fangke/2428869563/,2016-03,感觉很舒适进门的一瞬间就给人家的温馨。房间干净、整齐。每天早上醒来的时候就能感受到阳光，顿时显得轻松、舒适、自然。非常安静。周围交通出行也十分方便。总之是一次非常不错的入住。,,hz
1176262265,2604952462,1924097571,雷T,http://www.xiaozhu.com/fangke/1924097571/,2016-04,房东和室友都很随和，有家的感觉。位置也方便。五星评价。,,hz
1176262265,2592745662,1220472505,韩韩韩先森,http://www.xiaozhu.com/fangke/1220472505/,2016-03,挺不错 很温馨,,hz
1176262265,2490923862,1300836235,Warren2015,http://www.xiaozhu.com/fangke/1300836235/,2016-03,长住了，不多说,,hz
1176262265,2489527862,1411299435,施恰恰,http://www.xiaozhu.com/fangke/1411299435/,2016-03,美女房东人很好，因为一些个人特殊的原因，想要退房，房东也很温柔的给我退了，我用了温柔这个词??哈哈哈，而且，确实米粒,,hz
1176262265,2488557662,1399238135,hello小丸子,http://www.xiaozhu.com/fangke/1399238135/,2016-02,怀念这个房子,,hz
1176262265,2481967662,1967192071,tingting0221,http://www.xiaozhu.com/fangke/1967192071/,2016-03,美女房东很热心 房间布置的很舒服 很喜欢这里,,hz
1176262265,2427391162,245326800,anniking,http://www.xiaozhu.com/fangke/245326800/,2016-03,帮朋友爸妈定的房子，市中心，位置好，家里设施齐全。,,hz
1176262265,2416472562,2251896045,汤奇青,http://www.xiaozhu.com/fangke/2251896045/,2016-03,交通比较方便,,hz
1176262265,2333395862,1399238135,hello小丸子,http://www.xiaozhu.com/fangke/1399238135/,2016-02,要离开杭州了 很舍不得这里 杭州的家 ?? 和家人,真的好舍不得你离开，家人一样的朋友。以后会去找你玩的，么么哒,hz
1176262265,2181828359,1399238135,hello小丸子,http://www.xiaozhu.com/fangke/1399238135/,2016-01,很温暖的短租房,,hz
1176262265,2131167059,1399238135,hello小丸子,http://www.xiaozhu.com/fangke/1399238135/,2016-01,像家一样了 嘻嘻,,hz
1176262265,2031934781,1399238135,hello小丸子,http://www.xiaozhu.com/fangke/1399238135/,2015-12,舍不得离开了,更舍不得你离开咯。是家人一样的存在。,hz
1176262265,1827066334,1399238135,hello小丸子,http://www.xiaozhu.com/fangke/1399238135/,2015-11,杭州的家和家人,,hz
1176262265,1818896834,1782065135,西晨曦,http://www.xiaozhu.com/fangke/1782065135/,2015-11,Gooooooooooooooooooooooood,,hz
1176262265,1700893834,1128342078,Hamson,http://www.xiaozhu.com/fangke/1128342078/,2015-08,终于写评论写完了,,hz
1176262265,1691448334,1399238135,hello小丸子,http://www.xiaozhu.com/fangke/1399238135/,2015-11,喜欢 干净哦,,hz
1176262265,1658799734,1128342078,Hamson,http://www.xiaozhu.com/fangke/1128342078/,2015-10,很好，特别好，超级好～～～,,hz
1176262265,1563315334,1128342078,Hamson,http://www.xiaozhu.com/fangke/1128342078/,2015-09,好久木有点评了～～～哈哈,,hz
1176262265,1541334634,866293938,女王大人_花,http://www.xiaozhu.com/fangke/866293938/,2015-10,两个房东美女人特别好，很热情，住的位置也方便，房间也干净，空气也好，太满意啦，强烈推荐给大家。,,hz
