hid,did,uid,uname,ulink,checkindate,content,reply,CITY
2802881063,3797981128,3779517329,陶先生你好,http://www.xiaozhu.com/fangke/3779517329/,2016-07,环境不错，还有空调，地铁就在旁边。,谢谢小弟的点评，希望早日早到好工作,hz
2802881063,3399435428,3368457129,爱俊杰的佳妮,http://www.xiaozhu.com/fangke/3368457129/,2016-06,房东姐姐和哥哥人都超好，在姐姐家拍了戏很麻烦他们，中间也尽量保持静音配合我们，真的非常感谢,妹子人不错！在家里拍戏途中很维护家里的卫生以及家里的东西、,hz
2630896162,4626205712,4578467413,kabosu,http://www.xiaozhu.com/fangke/4578467413/,2016-09,不错，就是稍微远点，舒适度很高~,,hz
2630896162,3769946628,3643590929,葛林飞,http://www.xiaozhu.com/fangke/3643590929/,2016-07,房屋整洁干净，空间大，房东人很好说话，其他租客都挺和善。因为我要去市区，而坐公交需要走一段路，对我来说比较困扰。,感谢入住哦～希望下次给你带来更好的体验啦！来西溪湿地玩儿的时候可以再来哦!,hz
2630896162,3636007728,3404907029,JoannaR,http://www.xiaozhu.com/fangke/3404907029/,2016-07,姐姐人超级好！特别温馨的一个家！而且感觉又学到了很多！又成长了一些！?,跳街舞的小女孩儿，人特别可爱！有机会再见！,hz
2630896162,3576098228,3543094529,旅行者1212,http://www.xiaozhu.com/fangke/3543094529/,2016-07,房子很好，比宾馆都好,感谢选择我们家！下次有机会再见！,hz
2630896162,3520678028,3450233729,germ,http://www.xiaozhu.com/fangke/3450233729/,2016-06,各方面都很好，好评,谢谢入住啦，有机会再见面～,hz
2630896162,3357373428,3306751429,猫娘大人yuyi,http://www.xiaozhu.com/fangke/3306751429/,2016-06,哈哈哈对于我这种要进杭州市区的人来说 稍微有点点远 但是交通还是很方便的 b4可以直达附近 嗯 房东很漂亮！房东的馒头很好吃,可爱的大学生摄影师，感谢入住～,hz
2630896162,3302854128,1426124135,head,http://www.xiaozhu.com/fangke/1426124135/,2016-06,很好服崆橄麓卧,感谢入住，祝事业有成～,hz
2630896162,3286439228,3117923029,JackieCheng,http://www.xiaozhu.com/fangke/3117923029/,2016-06,房东人很好。房子也够大，全屋中央空调，性价比高，跟房东熟悉后说不定还能带你去阿里转一转，我问rancho说评论1000个赞够不够，rancho说还是10001个吧，怎奈何这里只能打2000字，那就只能运用数学公式了，（赞x10000）+1，哈哈哈！机智如我,哈哈哈哈，很好玩的男孩子啊！相处很开心，下次再来玩好吗～,hz
2630896162,2923253262,2912159763,辛宿,http://www.xiaozhu.com/fangke/2912159763/,2016-05,非常满意的一次入住。虽然是沙发，但是也很大，价格实惠，性价比是很高的，而且环境好，干净整洁。重点是房东人也很好，很耐心的跟我讲路线，非常感谢！,很可爱朴实的小姑娘，话不多但很有礼貌！希望有机会再见～,hz
2630896162,2916661062,2713281963,bob_,http://www.xiaozhu.com/fangke/2713281963/,2016-05,对我来说除了地理位置有些偏，其他都非常好，比青年旅舍好太多，,来杭州工作的运营哥们～人很好，和蔼可亲哈哈！希望能再见！,hz
2630896162,2862136762,2122145760,laponia,http://www.xiaozhu.com/fangke/2122145760/,2016-04,两位房主都是很有个性的女生，简单自然，不矫揉造作，相处得像朋友一样轻松自在。聊共同爱好的彩妆，满满的心声呐，特别开心。房主事无巨细地帮助房客解决各种问题，很友善，很值得入住哦！推荐推荐！,很投缘的女孩子，很有话题聊，人也超好，我搬东西也会帮我搬，还会帮忙搞卫生倒垃圾，人特别特别好，素质特别高，懂的东西也很多，而且还可以一起聊化妆！简直棒呆棒呆！希望有机会还能再见！后会有期.,hz
1602108035,4165477728,4095720429,火山哥在杭州,http://www.xiaozhu.com/fangke/4095720429/,2016-08,房子虽然不大，但该有的都有了。地铁就在楼下，小吃也好找。不错的一次入住。就是有点影响你们休息了，抱歉。,很让人省心的房客，很有计划地到杭州找工作，早上很早就到了，只能先去吃个早饭再来找我开门，很有礼貌。走的时候也把家里稍微收拾了一下，祝在杭州工作顺利！,hz
1602108035,4028045228,930911059,maoxiao7777,http://www.xiaozhu.com/fangke/930911059/,2016-08,非常不错的一次入住体验。周边交通很便利，就是离市区有一点远。沙发有点短，不过对于我们只入住几天的租客影响不大，而且价格也很合理。房东人很好沟通。给个赞,很巧也是学医的，而且连专业都一样！很有礼貌，很健谈，也很讲卫生，走的时候都是把床铺收拾干净，欢迎下次再来！,hz
1602108035,3753426828,3733780329,陆思恩,http://www.xiaozhu.com/fangke/3733780329/,2016-07,感觉不错，两位房东挺热情的,到杭州以来接待的年龄最小的房客啦！刚来可能还有点拘谨，毕竟也是头一次到杭州来。刚刚大二就要创业，小伙子很有前途，祝考察顺利~,hz
1602108035,2696184362,2519498963,zwk9lz,http://www.xiaozhu.com/fangke/2519498963/,2016-04,很好阿。 在杭州玩了几天。 房东超好了。 我走时还请我吃了早餐了。 三十六个赞。,弟弟年龄不大，自己在工作之余出游，还是很好的，可惜最近我们工作比较忙，有点早出晚归回来还在加班，没能好好聊一下，以后有机会也可以到北京哒，欢迎,hz
1602108035,2508283962,2383624163,cocos,http://www.xiaozhu.com/fangke/2383624163/,2016-03,房子非常干净，就在地铁旁，出行很方便，房东人也非常好，走的时候充电器落那里了，房东直接给邮寄过来了，太赞了，强烈推荐去杭州的朋友入住,由于上班比较忙，没有及时接待，不过美女自己找路过来的，从我邻居那里找到了钥匙。相处很愉快，希望在杭州找到合适的工作，以后都在杭州，有机会一起出去玩,hz
1602108035,2338475662,2223503145,zw0gz0,http://www.xiaozhu.com/fangke/2223503145/,2016-02,姐姐家挺干净的，还可以烧饭！光线也好，如果不是过年的话周边肯定也挺热闹，挺好玩的！,正好在我回家的这段时间里入住的，开始还有点不放心把房子交给陌生人，但是弟弟过来看房，聊了一下觉得还比较踏实，就自己回北京度假，把房子客厅留给了这个弟弟住，回来的时候家里像没住过人一样，收拾的很干净。,hz
1602108035,2303738126,2268606645,我的心有扇门,http://www.xiaozhu.com/fangke/2268606645/,2016-02,东北的大姐，很健谈，工作很繁忙，虽然性别有差，但是这两天沙发生活过的很开心。非常聊得来。房屋环境十分朴素，值得短租，价格公道，地理位置优厚。离公司半小时路程，配套设施良好，旅行特推该处，有机会希望能过在有一次旅行,弟弟还是很有礼貌的，很注意家里卫生，而且比较健谈，从上学到美食，都能聊的很多。我这刚刚回家，所以家里稍微有点无序，希望不要介意。祝工作顺利吧！,hz
1602108035,2112680659,271139700,吴亚利,http://www.xiaozhu.com/fangke/271139700/,2016-01,地理位置特别好，下地铁就是，一点不假，房东人也特别好。,,hz
1602108035,1909330170,1615650735,卢熙婧,http://www.xiaozhu.com/fangke/1615650735/,2015-10,就像回到自己家一样舒服！位置虽然是在杭州萧山区，但是因为通了地铁所以非常的方便，到火车东站也只要半个小时，地铁方便！出地铁口附近就可以找到，很方便！有电梯。姐姐人很好！这是最关键的啊！感觉像多了一个姐姐。姐姐还会做早餐给我吃，好温馨！非常的干净！是很好的小区所以也非常的安全！,,hz
1602108035,1846289834,1767066235,涅乐,http://www.xiaozhu.com/fangke/1767066235/,2015-11,超好的房东！人很善良！希望以后能够多多联系！,大哥人很好，特别有礼貌，我这几天老加班，害的他在外面等我，但是他没抱怨过，还一直说是给我添麻烦了。来的时候带了酸奶，走的时候还买了栗子，说实话到了杭州还从来没吃过栗子，所以谢谢大哥！希望尽快找到合适的房子～,hz
1602108035,1738437534,102422400,run_sh,http://www.xiaozhu.com/fangke/102422400/,2015-11,虽然沙发有点短，但是房主和环境都非常好，赞,弟弟算是毕业旅行到的杭州，本来不打算接待男生的，但是因为这会儿男朋友在家，所以还好。出游比较匆忙，到杭州估计时间也比较赶，再加上我这几天加班很忙，没怎么太聊天。房客比较有礼貌，一直说怕打扰我们，走的比较早都很安静，把家里床铺也收拾好了，祝旅途愉快工作顺利！,hz
1602108035,1624896034,1615650735,卢熙婧,http://www.xiaozhu.com/fangke/1615650735/,2015-10,房东姐姐人很好！环境整洁！交通方便，楼下附近就是地铁站，去哪都方便！以后来杭州还可以住这里就好了,很客气的一个妹子，我们一起住卧室，早上起床时间差不多，所以基本每天一起能吃个早饭，有个室友的感觉还不错诶！晚上还买个披萨回来吃，很好！就是抱歉我也才到这边来，房子还没有做装饰，被子也有点薄，下次再过来就好啦！工作加油哦！欢迎下次来还住我家~,hz
3443249229,3673898028,3591585429,yrpuez,http://www.xiaozhu.com/fangke/3591585429/,2016-07,这是第一次住小猪，房东家很整洁，交通位置特别好，就在地铁站旁边～唯一不足就是楼层有点太高啦～不过屋子有两层～其他房客也都是很好的～我是出来玩～聊的很开心～下次去杭州也会住那里啦～,谢谢您的理解和支持，祝你旅途愉快！(^_^),hz
3443249229,3542882028,3437573429,byeors,http://www.xiaozhu.com/fangke/3437573429/,2016-06,很干净环境不错，闹中取静，离龙翔桥湖滨都不远，周围还有好多小吃和自行车租赁点，骑车5分钟到西湖兜兜风～ 交通很便利。房东大哥人特别好，订房之前还给打电话讲解房子和周围环境情况，还帮我把大行李箱扛上楼，一百个赞 好评好评！,谢谢！小姑娘善解人意！也非常不容易，一个人远走他乡，祝你早日找到喜欢的工作！,hz
2410291963,3666991828,3608397229,丹丹joy,http://www.xiaozhu.com/fangke/3608397229/,2016-07,挺好的，第一次住沙发,很好交流的妹子，祝顺利,hz
2410291963,3350634828,3277194229,desperateqin,http://www.xiaozhu.com/fangke/3277194229/,2016-06,"第一天是nightmare, 3楼没有电梯，自己提上去的，沙发太热，还没有小床单，给的是铺盖一起的小棉被，哈哈。没有枕头，只有靠垫。。。但第二天房东很贴心的给换了床铺，她家的小房间床铺还是不错的，但沙发夏季还是不推荐了！Anyway, 还是祝善良的房主生意兴隆",房间四件套都是一客一换的的，因为临时改变住的房间，美女说被子太厚，就给你换了个空调被，因为我也急着出门上班所以没有给你套被罩。美女有问题其实当时就可以和我沟通的哦，没必要这样委屈自己的。最后祝你旅途愉快！,hz
2410291963,2944247462,350906400,ise001,http://www.xiaozhu.com/fangke/350906400/,2016-05,小区环境安静 房主很好 下次有机会还入住,很好相处的大哥，欢迎你下次再来,hz
2410291963,2870462362,1804743635,Billy_Chou,http://www.xiaozhu.com/fangke/1804743635/,2016-05,房东人非常好，晚上快一点了还出来接我，并把东西都准备好，非常不好意思啊…房子总体来讲还是很不错，毕竟只是沙发也没办法要求那么多，休息好就好。不足是睡得时候有些闷热，而且开始有蚊子了…… 房东养两只猫，很温顺的，发出的声音像是小孩子的叫声特别可爱。整个晚上休息的还算不错，很安静 。,谢谢你的评价，祝你旅途愉快,hz
2410291963,2838981462,2804390363,陈博权,http://www.xiaozhu.com/fangke/2804390363/,2016-05,挺好的！房东家里有两只猫，蛮可爱的。,很安静的女孩子，希望你旅途愉快！,hz
2410291963,2827062062,2808173463,normo,http://www.xiaozhu.com/fangke/2808173463/,2016-04,感觉像朋友家 轻松随意 猫猫就睡在脚边,很好相处的男孩，被子也收拾的很好！祝旅途愉快,hz
2410291963,2605923462,2600532263,功勋饲养员,http://www.xiaozhu.com/fangke/2600532263/,2016-04,两只猫咪萌萌哒，一觉睡得很舒服。房东很好喵～,很不错，被子收的很好,hz
2734984663,4391015212,1504811135,ashleyzheng321,http://www.xiaozhu.com/fangke/1504811135/,2016-08,特别温馨，阳台赞爆啦，有机会还过来^,,hz
1497951135,4595488012,4544844813,2m86vk,http://www.xiaozhu.com/fangke/4544844813/,2016-09,非常实惠，方便,协商后提前退房,hz
1497951135,4084468728,3931027029,D_view_s,http://www.xiaozhu.com/fangke/3931027029/,2016-08,房东人很好，下飞机太晚了；路上又出了点状况，一直等到我晚上两点。家里特别干净，各方面都很舒适……,谢谢你，太累了，没来得及打招呼,hz
1497951135,3950320228,3881868829,duman130,http://www.xiaozhu.com/fangke/3881868829/,2016-07,要离开包邮区了，最后来一趟杭州找点能回忆的东西，住一晚匆匆离开，家里很安静很干净，晚上休息的还可以，我自己常年睡沙发，所以房东的沙发完全能接受，WiFi够快，淋浴够爽，唯一的问题可能就是位置偏僻一些，我本来就要滑板刷街对我到没什么影响，大概就这些了，据说满100个字有积分奖励，我就在多写一些字吧，祝入住的房客越来越帅气美丽~祝房东财源广进房子一套又一套,很帅的小伙子,hz
1497951135,2708509562,2646303263,洪华建,http://www.xiaozhu.com/fangke/2646303263/,2016-04,忘了拍照了我，应该留几张photo，有家的感觉，嘻嘻哈哈的！很开心！下次有时间还去住段时间！！ 你们也要注意身体！早点休息！,年轻有为的骚年，有缘再见,hz
1497951135,2482296162,2431036263,Renlie,http://www.xiaozhu.com/fangke/2431036263/,2016-03,哈哈哈哈哈我也没见着你,可惜没见着,hz
1497951135,2068011081,2039837182,cathylong,http://www.xiaozhu.com/fangke/2039837182/,2016-01,2位90的房东，知识背景丰富，非常擅聊。,很有想法很友善的一位姐姐，希望你的事业 越做越好,hz
1497951135,2018891581,1772221335,红红Lilian,http://www.xiaozhu.com/fangke/1772221335/,2016-01,与房东一口气聊了4个小时...,让我脑洞大开的房客～,hz
1497951135,1943232570,1791783335,cn_qg,http://www.xiaozhu.com/fangke/1791783335/,2015-12,房子很整洁，主人待客也很友好，天很冷也备有加热毯子等设施，一个字:赞。。。很不错，下次还会来住,很有气质和素养的叔叔,hz
1497951135,1748233734,1745715735,朴素不争,http://www.xiaozhu.com/fangke/1745715735/,2015-11,很赞，我靠还要5个字以上,好好人呐，还给我们带了水果，昨天聊了很多也学到很多东西，谢谢你~~,hz
1497951135,1742509234,1133547855,Lucianne,http://www.xiaozhu.com/fangke/1133547855/,2015-11,房东很好的人,不错的房客,hz
4187770929,4298238512,2558438363,yimis,http://www.xiaozhu.com/fangke/2558438363/,2016-08,房东小姑娘人很好 房间也很干净 很好相处呢,超级nice的辣妈 和超Q的宝宝～相处很愉快～,hz
2400457962,4620754012,3249975929,iGot7,http://www.xiaozhu.com/fangke/3249975929/,2016-08,还不错~.,,hz
2400457962,4315314812,3249975929,iGot7,http://www.xiaozhu.com/fangke/3249975929/,2016-08,整体都很好，除了网速一般，WIFI信号弱。,,hz
2400457962,4235275212,3027810629,mjjjjjjj,http://www.xiaozhu.com/fangke/3027810629/,2016-08,很好很好 很好,,hz
2400457962,4045464128,4031306129,开坦克的孙悟空,http://www.xiaozhu.com/fangke/4031306129/,2016-08,除了交通有点小不方便，其他的超赞，房间干净，很舒服，大家都很热情,,hz
2400457962,3990253728,2253794145,reginaG,http://www.xiaozhu.com/fangke/2253794145/,2016-08,干干净净房间，小区也比较新，挺好的,很和善的姐姐，感谢入住哦～,hz
2400457962,3248424528,2892604463,次不了辣的应先森,http://www.xiaozhu.com/fangke/2892604463/,2016-06,房间很大，客厅也宽敞，相应的设施也很齐全，最重要的是房东漂亮，有机会的话以后还来住…,宁波帅哥一枚，感谢入住，欢迎下次再来玩～,hz
2400457962,2620594562,2489754263,丁尧,http://www.xiaozhu.com/fangke/2489754263/,2016-04,非常棒的房间非常棒的房东，可惜行程变化只住了四天，以后来杭州出差都会优先考虑来这里，有家的感觉,很巧的房客是同事！欢迎下次再来～,hz
2400457962,2612809162,2565355863,燕归魂飞,http://www.xiaozhu.com/fangke/2565355863/,2016-04,房东人特别好，是个很年轻的姐姐，我问了很多问题，都很耐心地回答，住的房间不是很大，但是够用了，床单被套什么的也很干净，最喜欢的是厨房可以做饭，也不用自己带调料什么的小东西，房东那里都有提供，过去以后带条毛巾就好，性价比很高，推荐其它房客去住~,超级可爱的女孩纸！！！,hz
3197473833,4609243012,4455965313,晴空g2,http://www.xiaozhu.com/fangke/4455965313/,2016-09,房东很热情，居住环境很舒适，位置也很优越，一次不错的入住体验。,博士后姑娘，集美貌和智慧于一身，居然还单身，男生们去哪了,hz
3197473833,4263914412,1221536605,bluuuu,http://www.xiaozhu.com/fangke/1221536605/,2016-08,房东跟好沟通，服务很周到,一切安好，热爱户外运动的好少年！哦，对了，问题有点多,hz
3197473833,4125187928,2699596663,7ztm,http://www.xiaozhu.com/fangke/2699596663/,2016-06,很好，交通便利旁边就是地铁站,离开时候房间整理很好，因为有事外出，当晚简单聊了几句就离开了，接待不周，见谅哈！,hz
3197473833,3723758528,1504811135,ashleyzheng321,http://www.xiaozhu.com/fangke/1504811135/,2016-07,特别能侃的房东，也很贴心、地理位置超级赞啊强烈推荐，附近都订不到房间了。而且房东是个马拉松爱好者，墙上那快20个马拉松金牌简直太赞了！羡慕房东的人生～,小姑娘很nice，习惯也很好，聊起来也挺聊，经历丰富，美丽大方，值得推荐的旅客！,hz
2776094562,4308175212,3616032429,8rug,http://www.xiaozhu.com/fangke/3616032429/,2016-08,房东人很好，房间也住的蛮舒适的，就是交通可能稍微有一点点不是很方便,两个学生暑假实习，住了一段时间，不吵闹，走的时候房间干干净净的，下次再来咯,hz
2776094562,3232149328,2183200693,ILovelife,http://www.xiaozhu.com/fangke/2183200693/,2016-05,首先那北苑小区优雅清新的环境还是让人比较满意，且又遇上一对热情助人的90后恋人为房东，特别是那男房东任兄弟再三给我介绍周围好玩的地方，至于房间应该是刚装修不久吧，不但干净整洁且生活用品配备齐全，实物比网上图片要好的，本人一住便是两个星期呀……,很客气的一个男生，下次再见啦,hz
2397241663,4341874512,4243756713,洪小霁,http://www.xiaozhu.com/fangke/4243756713/,2016-08,非常棒的入住体验。小区门口就有一个公交车站，西溪印象城也不远，第一天就去西溪印象城玩耍了。小区整体都非常安静，关键是小区里面有塑胶跑道第二天早上起来就晨跑哈哈哈，晨跑的人很多还有打太极的老爷爷。房东非常棒哦，提前确认入住时间，房子非常干净整洁，各种问题也都有求必应。下次来实习还会住这里哒。,,hz
2397241663,3418011428,3027810629,mjjjjjjj,http://www.xiaozhu.com/fangke/3027810629/,2016-06,房东和租客都超nice！,很可爱的很有礼貌的一对情侣，感谢入住～,hz
2397241663,3138367028,2945718263,盐慎,http://www.xiaozhu.com/fangke/2945718263/,2016-05,很舒服的一次体验，之前有被太多app坑过各种图实不符，这次竟然完全一样，房间里外都很干净，房客们也都很友善。 总而言之，作为初次来杭州的求职者，能遇到这样的住宿环境，真的太开心了，惊喜满满。 可惜的是忘记续租了，所以要搬走了，还挺遗憾的。 很棒的一次住宿体验，开心。,做新媒体的小哥哥～人很好啊还帮忙一起搬床什么的，有机会多来玩～,hz
2397241663,2828648662,2489401663,根毛,http://www.xiaozhu.com/fangke/2489401663/,2016-04,很和谐，住了就不想走了。房东居然还可以点评我，醉了……,技术大牛，智商高～感谢入住！,hz
2397241663,2773238462,1161046705,jackyo,http://www.xiaozhu.com/fangke/1161046705/,2016-04,比较仓促，谢谢,人很赞的房客哟,hz
2397241663,2632188862,2462105163,烛芒,http://www.xiaozhu.com/fangke/2462105163/,2016-04,出来给学校干活还不给报销只好节衣缩食，最喜欢硬板床了，正好就是终于不会第二天睡醒一觉腰疼QAQ 房间超级好还有我长草好久的沙包沙发，一切都很好，有阳台有浴室还很干净~~~ 蟹蟹房东啦~【有点舍不得的样子,非常非常抱歉，没有即使告知您房间已出租，欢迎下次来玩！,hz
2397241663,2480110062,2171078360,孤单旅行666,http://www.xiaozhu.com/fangke/2171078360/,2016-03,住了很长一段时间，央企的房子，小区内环境不错，性价比很高，一起玩的也很好，走的时候有些不舍的感觉，有机会去杭州还会来的,机智的小伙儿！ 人超级好哒！,hz
2401093662,4629347512,2383995063,身正为范学高为师,http://www.xiaozhu.com/fangke/2383995063/,2016-03,"工作原因,晚评了。房间非常干净和温馨。非常适合出差、旅游居住。给予最好评价。",人很好哒房客,hz
2401093662,3376811328,3336328429,Angela锦梅,http://www.xiaozhu.com/fangke/3336328429/,2016-06,除了出行稍微麻烦了点，其他都很好，很不错的一次民宿体验,感谢入住！,hz
2401093662,3277208328,2976933463,ardorbird,http://www.xiaozhu.com/fangke/2976933463/,2016-06,在一个有门禁的小区之内，住的非常安心。房东非常热心，有什么问题积极帮你解决。房间配套设施非常好，住宿环境很舒心。,有政治观点的技术大牛，感谢入住！,hz
2401093662,3074680028,2999768263,Leonardo_Z,http://www.xiaozhu.com/fangke/2999768263/,2016-05,房东人很好，有问题也都很热心回答。没有什么不舒服的地方，和图片就是一模一样的。,没有接触太多，感觉很腼腆哈哈～不过人很好很可爱！希望下次能再见！,hz
2401093662,2916730362,2713281963,bob_,http://www.xiaozhu.com/fangke/2713281963/,2016-05,来附近出差、找工作、游玩的短期居住的不二之选,过来找工作的运营哥哥～很好相处！,hz
2401093662,2913808962,2489401663,根毛,http://www.xiaozhu.com/fangke/2489401663/,2016-05,这算什么点评啊……,好人一生平安！,hz
2401093662,2703129462,1777847735,he6f,http://www.xiaozhu.com/fangke/1777847735/,2016-04,住的挺舒服，就是吃饭有点太远。,很爽快的两夫妻！,hz
2401093662,2481487262,2253113345,v67z,http://www.xiaozhu.com/fangke/2253113345/,2016-03,真的很不错！,很实在的房客！人很好哟！,hz
3627522530,4030948528,2851624763,谜迷弥靡,http://www.xiaozhu.com/fangke/2851624763/,2016-07,在这里住得很愉快，房东人很好，缺什么就给你补什么，不用你操心。整体环境卫生都还蛮干净的，平时窝在自己的小房间里上上网也挺惬意，想出去玩，附近有杨家村公交站可坐，距离杭州东站，地铁口打个的十几分钟就到，交通还算方便，总之，居住性价比可以的。,,hz
3627522530,3884972328,3702535729,xiaok0629,http://www.xiaozhu.com/fangke/3702535729/,2016-07,房间干净整洁，小两口热情大方，女主人还给准备了洗漱用品，第一天非要留我和他们一起吃饭，两人厨艺都不错。住了10天中间女主人还专门准备了第二套床单被罩，非常感谢小两口的热情招待，很不错的一次短租体验。,房客很好，也是个互联网人，大家都比较说的来。因为平时上班，所以交流也不是特别多，但是房客人很好，还给我们吃梨！祝房客在杭州幸福的生活下去！,hz
2685873163,2879486762,2795909363,Rayquake,http://www.xiaozhu.com/fangke/2795909363/,2016-05,美女房东是个可爱的修图师小姑娘，人美饭也做的好吃，周末下班做了一桌好吃的，来杭州吃的最饱的一顿。,房客文明礼貌，大家相处融洽，很高兴通过小猪短租有缘结识一位朋友！,hz
2718357262,3606700228,3457276029,李梅芳,http://www.xiaozhu.com/fangke/3457276029/,2016-07,房东人很好，房子住着很舒服，虽然是沙发，但很宽敞，睡得很好,,hz
2718357262,3449233428,3445165529,wwx2468,http://www.xiaozhu.com/fangke/3445165529/,2016-06,过去的有点晚，房东也还是没睡。房子是跃层，沙发在楼下，很是清净。房东也考CPA呢，真是缘分啊！一起加油！,房客蛮健谈的，是个沙发老客了，不错的房客,hz
2718357262,3329270828,3249514629,一只猱,http://www.xiaozhu.com/fangke/3249514629/,2016-06,阿姨人很好В我们麻烦了很多事，阿姨也很耐心地帮我们。,这次由于时间原因没碰到她们，但从沟通来看是有礼貌的同学，也保持了我房间的整洁性,hz
